id,name,text,trans
5007001000220010,結華,ああっ、あそこのアピールが上手いこといってればー！,"Ugh, if I had only gotten that appeal right!
"
0000000000000,プロデューサー,惜しかったな結華……,"I know this is tough, Yuika..."
5007001000220020,結華,"……三峰の足りないところ、よっくわかりました
そりゃあもう、痛いほど！","...Mitsumine definitely knows what she needs to work on now. She's painfully aware, you could say!"
5007001000220030,結華,"この程度でへこたれる三峰じゃないもんね、
もう帰ったらめっちゃレッスンするから！",But this minor defeat isn't going to discourage Mitsumine! I'm gonna go home and practice a ton!
5007001000220040,結華,次は絶対どうにかしてやる……！,"I'll win next time, one way or another! "
0000000000000,プロデューサー,"ああ、その意気だ！　俺ももっと勉強するよ
次はしっかりプロデュースできるように","Yeah, that's the spirit! I'll study how best to help, too. So I can produce you better next time."
5007001000220050,結華,了解。任せたからね！　プロデューサー！,"Understood. I'm counting on you, Producer!"
info,produce_communication_auditions/500700100022.json,
译者,,
