id,name,text,trans
0000000000000,プロデューサー,"（２８３プロダクションに入社して数か月……
いよいよ俺が、アイドルをプロデュースする時が来た）",(A few months have passed since I started working here at 283 Production...... Now the time has finally come for me to produce an idol myself.)
0000000000000,プロデューサー,"（ずっと憧れていた仕事をようやく任されたんだ、
これから精一杯頑張るぞ！）","(I'm finally getting to do the job I've dreamed of for so long, so I want to do my very best!)"
0000000000000,プロデューサー,"おはようございます！
って、天井社長……？","Good morning!
Ah! President Tenjou......?"
1902001010010,社長,おはよう、お前を待っていたぞ,Good morning. I've been waiting for you.
0000000000000,プロデューサー,"（この２８３プロダクションを束ねる
天井社長……あいかわらずダンディな雰囲気だ）",(President Tenjou is the boss here at 283 Production...... He comes off as a bit of a dandy.)
1902001010020,社長,"お前には今日から、アイドルを
プロデュースしてもらうと伝えていたが……","I'm here to tell you that starting today,
you will begin producing an idol yourself......"
1902001010030,社長,"素晴らしい結果を期待させてもらう
私は甘くないぞ","I'm expecting some spectacular results.
I am not a lenient man."
0000000000000,プロデューサー,は、はい！　よろしくお願いします！,O-of course! I will do all I can!
1902001010040,社長,よろしい。では、仕事の説明ははづきに任せて……,"Excellent. I'll let Hazuki explain the rest...... "
0000000000000,プロデューサー,？　はづきさんはどこにも……あっ！？,"? Where is Hazuki-san, actually..... Woah!?"
0000000000000,プロデューサー,（そ、ソファの裏で誰かが倒れてる！？）,(T-there's someone passed out behind the sofa!?)
1901001010010,はづき,"……ふわぁ～？
なんですか～急に大きな声出して～……","......Mhmhn～?
What's going on～ Why's everyone being so loud～......"
1902001010050,社長,は、はづき……なぜ床で寝ているんだ,H-Hazuki...... Why were you sleeping on the floor?
1901001010020,はづき,"すみません、ソファへ着く前に
眠気に負けてしまいまして～……","My apologies, I was so sleepy,
I couldn't make it to the sofa in time～"
1902001010060,社長,せっかくまじめな雰囲気を出したというのに……,"We are trying to look professional here, you know......"
1902001010070,社長,"……ともかく！
彼に仕事の説明をしてくれ",".......Moving on! 
I'd like you to give him the details of his new job."
1901001010030,はづき,"はい、もちろんです
プロデューサーさん、どうぞ～","Yes, absolutely.
Producer-san, please take these documents～"
0000000000000,プロデューサー,"ありがとうございます
……あいかわらず、わかりやすくまとまってますね、資料","Thanks. As always, you've made everything so easy to understand. "
0000000000000,プロデューサー,（はづきさん、こういうところは頼れるんだよな……）,"(When it comes to her job, Hazuki-san is actually quite reliable.....)"
1901001010040,はづき,"ありがとうございます
それじゃあ、さっそくお仕事の説明に入りますね～","Why, thank you.
Alright, allow me to explain......"
1901001010050,はづき,まず、今回のプロデュースの目標についてですが……,"To start, let's discuss your main goal....."
1901001010060,はづき,"ワンダーアイドルノヴァ・グランプリ……
通称『W.I.N.G.』への出場を目指してください","You will aim to have your idol participate in
the ""Wonder Idol Nova Grand Prix"", commonly known as ""W.I.N.G.""."
0000000000000,プロデューサー,『W.I.N.G.』……ですか,"""W.I.N.G.""…… You say?"
1901001010070,はづき,"はい
新人アイドルの祭典とも言われる、すごいライブなんです",That's right. It's a special live that celebrates the best newcomer idols.
1901001010080,はづき,"祭典と言われるだけあって、この『W.I.N.G.』は
出場資格を手に入れるまでが厳しいんです……","While W.I.N.G. itself is a celebration, the qualifications that must be met to participate are quite strict......"
1901001010090,はづき,"エントリーしたアイドルは開催前まで、
全４回のシーズンごとに審査を受けます","Idols who want to participate in W.I.N.G. must meet specific goals for four consecutive seasons, and the bar is raised each time."
1901001010100,はづき,"その時、一定のランクに達していないと、
出場資格を失ってしまうんです","If these goals aren't reached by the end of a season, the idol will no longer meet the qualifications to participate in W.I.N.G."
1901001010110,はづき,"ですので、精一杯頑張っていきましょ～！
私もたくさんサポートさせていただきますね～","That being said, let's try our very best～!
I will do everything I can to support you～"
1902001010080,社長,"……少しアドバイスをしておくが、
お前は、２８３プロダクションのプロデューサーだ","......Here's a bit of advice.
You are now a producer here at 283 Production. "
1902001010090,社長,"担当アイドルと他のアイドルたちを
交流させることも重要になってくる","It is utmost importance to allow the idol
you'll be producing to network with the other idols here."
1902001010100,社長,互いに影響しあうことで目指せる高みもあるだろう,"With each other's influence our idols
will be able to soar to even greater heights."
1902001010110,社長,"まあ、まずは思うようにやってみるといい
結果がついてくるかは、お前とアイドルの頑張り次第だ","I recommend you begin by simply doing what you see fit. Whether good results follow depends on the effort of both you and the idol you produce. "
1901001010120,はづき,"では、そろそろお仕事に移ってもらいましょうか
今回プロデュースするアイドルは──","Alright, it's time for your job to officially begin.
The idol you will be producing──"
1901001010160,はづき,"プロデューサーさん自身の手でスカウトしてきてください
素敵な子、見つけてくださいね？","Will be someone that you scout yourself, Producer-san. Please, go out and find us a wonderful candidate～"
0000000000000,プロデューサー,"わかりました！
じゃあ、行ってきます！","Understood! Well, off I go!
"
0000000000000,プロデューサー,"（と、勢いよく出てきたまでは良かったけど、
なかなかピンとくる子がいないな……）","(I was feeling so confident when I went out, but I haven't seen anyone who seemed like a good fit around town......)"
0000000000000,プロデューサー,"（雨も降ってきたし……
どこか、雨宿りできるところは……）","(And now it's started to rain...... Is there somewhere covered where I can wait it out......?)
"
0000000000000,プロデューサー,"（よし、ここなら濡れないか……
ずいぶん大降りになってきたな）","(Nice, this overhang should keep me dry...... Whew, it's really coming down now.)"
1007001010010,？？？,ひゃーっ、雨とか聞いてないってー！,Augh! I didn't hear it was supposed to rain!
1007001010020,？？？,グッズ濡れてないよね？　大丈夫だよね？　えっと……,Did any of my merch get wet? Hopefully it's all OK. Let's see.......
0000000000000,プロデューサー,（あの子も雨宿りか……）,(Looks like she's trying to stay out of the rain too......)
0000000000000,プロデューサー,"（……ん？　おおっ、すごいなあのカバン
人気アイドルのライブ限定品がぎっしり……）","(......Oh? Woah, her bags filled to the brim with live-exclusive merch for popular idols......)"
1007001010030,？？？,"こっちは平気だし、これも……！
……ん、全部おっけー！　良かったぁ","This stuff's all fine, and over here too......! ......Whew, it's all safe! Thank god."
1007001010040,？？？,"あ、すみません騒がしくしちゃって！
うるさかったですよね？","Oh sorry, there I go talking to myself! I being loud, wasn't I?
"
0000000000000,プロデューサー,え？　ああ、いえ。大丈夫ですよ,"Huh? Oh no, not at all. "
1007001010050,？？？,それなら良かったです,"Well, that's good."
0000000000000,off,off,off
1007001010060,？？？,……これ私の方が濡れちゃってるな……ハンカチは──,"......Trying to keep my merch dry, I got wet instead...... Where'd I put my handkerchief──"
0000000000000,プロデューサー,……あ。缶バッジ、落としましたよ？,"......Oh! One of your pins fell, here you go."
1007001010070,？？？,"えっ？　あ、ほんとだ！
すみませんっ、ありがとうございます！","Huh? Oh crap, it did! Thank you so much!"
1007001010080,？？？,"良かったぁ……！
これ限定のヤツなんです、助かりました！","Thank god......! That one was limited edition, you really saved me!
"
0000000000000,プロデューサー,（──……いい笑顔だなぁ……）,(──......What a nice smile......)
0000000000000,プロデューサー,"（……それに、缶バッジでこんなに喜ぶところといい、
あれだけのグッズといい、本当にアイドルが好きなんだ……）","(......And with how happy she is over just a little pin, and all that merch in her bag...... It's clear she really loves idols......)"
0000000000000,プロデューサー,（……この子なら、きっと……！）,(......I think she would be perfect......!)
0000000000000,プロデューサー,"あの……すみません
急にこんなこと言われて戸惑うかもしれないんですが……","Ah...... Excuse me. This might seem like a strange thing to say out of nowhere, but......"
0000000000000,プロデューサー,アイドルに、興味はありませんか？,Would you be interested in being an idol?
1007001010090,？？？,……はい？　アイドル？,......Uh? An idol?
0000000000000,プロデューサー,"そうです
あなたに、アイドルになってもらいたいと思いました","Yes. I'd like to help you become an idol.
"
1007001010100,？？？,……え、えーと……いきなり何事っていうか……,"......Uh, wow...... Not really sure what you're trying to say......"
1007001010110,？？？,"……あっ。お兄さんも実はドルオタなんですか？
話せそうな人見つけちゃって嬉しいなー、みたいな！","Oh, maybe you're an idol fan too? And you're like, excited you found someone you can talk about them with!"
1007001010120,？？？,"それとも遠回しなナンパです？
俺だけのアイドルになってくれ、的な","Or was that a thinly-veiled pick-up line? ""Hey girl, I'll make you my idol～"" or something?"
0000000000000,プロデューサー,そうではなくて……自分は、こういう者です,"No, nothing like that...... I'm a producer. Here's my card."
1007001010130,？？？,２８３、プロダクション……？,"283, Production......?"
0000000000000,プロデューサー,"あなたなら、素晴らしいアイドルになれると思ったんです
どうでしょうか？",I think you could become an amazing idol. What do you say?
1007001010140,？？？,"……あ、あははー……
その冗談、今日イチ面白いです。本当は芸人の方だったり？","......Ah, ahahah...... That's the funniest thing I've heard all day. So, you're actually an undercover comedian?
"
0000000000000,プロデューサー,"いえ、本気です
本気で……あなたに、アイドルになってもらいたいんです","This isn't any kind of joke. I really mean it, I want to help you become an idol. "
1007001010150,？？？,……私が、アイドル……,"......Me, an idol......"
1007001010160,？？？,"いや、興味はめっちゃありますけど……
……え？　ほんとに？",I can't say I wouldn't be very interested but...... Um? Are you actually serious?
0000000000000,プロデューサー,"本当です
一緒にアイドル、目指してもらえませんか","I'm completely serious. Together, I want us to try and make you into the best idol you can be."
1007001010170,？？？,……そ、そこまで言ってもらえるなら……,"......If you're going that far with this, then......"
1007001010180,結華,……三峰、結華です。これから、よろしくお願いします,"......I'm Mitsumine, Yuika Mitsumine. Nice to meet you. I'll be in your care."
info,produce_events/100700101.json,
译者,,
