id,name,text,trans
2007007110010,結華,…………,......
2007007110020,結華,……三峰さぁ、虫がダメなの,...Did you know that Mitsumine can't stand bugs?
0000000000000,プロデューサー,……うん？,...Hmm?
2007007110030,結華,……虫,...Bugs.
2007007110040,結華,"誰かと一緒にいる時は、
頑張って慌てないようにしてるけど……","I usually hold myself together whenever
someone's with me though..."
2007007110050,結華,"ほんとはまわり飛ばれるだけで怖いし、
あと、触りたくないから追い払えなくて、すごく困る","But it's freaky to see them buzzing around.
I don't wanna touch them either, so it's a huge
pain to get rid of them."
0000000000000,プロデューサー,そうだったのか,That so?
2007007110060,結華,……うん,...Yes.
2007007110070,結華,"──それからね、誰かと一緒に買い物に行くのも、
ほんとはそんなに好きじゃない","──And you know what else?
I don't really like shopping with other people."
0000000000000,プロデューサー,えっ,Huh...?
2007007110080,結華,"……自分の物買おうとしてる時に、
相手のこと付き合わせちゃってるなーって感じるのが嫌でね","...When I'm doing my own shopping and someone
else is with me, I hate the feeling of needing to
make sure that I'm entertaining them."
2007007110090,結華,"今このショップ見ててつまんなくないかなぁとか、
待たせないように選ばなきゃ、とか……","I'll worry that they'll just stand there all bored,
waiting for me to be done. So I have to rush myself..."
2007007110100,結華,"色々考えてると疲れちゃって、
買い物が楽しくなくなっちゃったりして──","It's draining to be considerate like that.
It just takes all the fun out from shopping──"
0000000000000,プロデューサー,"それは──す、すまん……！
今まで何度も付き合ってもらってるよな……！","Sorry! I-I didn't know...! I've had you accompany
me on so many shopping trips too...!"
2007007110110,結華,"あっ、違うの違うの
プロデューサーに文句言ったわけじゃなくて","Ah, wait, you got the wrong idea!
This isn't me trying to list down a bunch of
complaints to you, Producer."
2007007110120,結華,"誰かの買い物についてくのは大丈夫なんだ、
むしろ好きなぐらい！","And when I'm tagging along for someone
else's shopping trip, it's totally fine! 
I actually quite like it!"
2007007110130,結華,それに──……,And plus...
2007007110140,結華,"……最近は、自分の買い物の時でも……一緒にいて
嫌じゃない人がいるんだなぁって、わかってきたとこだし","Lately, I've realized that even when I'm doing my
own shopping, there are people who I don't mind
tagging along."
2007007110150,結華,……アンティーカのみんなとか、プロデューサーとかね,"Like everyone in L'Antica, and you too, Producer."
0000000000000,プロデューサー,そ、そうか……？,I-I see...
2007007110160,結華,うん,Yup.
2007007110170,結華,"それから──……
えっとね……","So, let's see...
Next would be..."
2007007110180,結華,"……三峰の性格ってアレだから、こいつ面倒だなって
思われてないか、不安になることがあって……","...Mitsumine isn't always the easiest person to try
to get closer to, you know? It concerns me that
others might think I'm a pain because of that..."
2007007110190,結華,"……そういうこと考えてる時の自分は、
ちょっと嫌になる","...When I worry about that,
I start hating myself a little."
0000000000000,プロデューサー,──それは,──But that's...
2007007110200,結華,"えへへ、人の目が気になるのって、
人として当たり前のことだと思うんだけどさ","Ehehe, it's only natural for people to worry
about what others think of them."
2007007110210,結華,"でも、三峰は好きでこの性格やってるわけじゃん？
だったらうじうじ気にしたりしちゃダメでしょ、みたいな","The thing is, Mitsumine lives her life this way
because she wants to, right? So she shouldn't
be having any second thoughts about it, should she?"
2007007110220,結華,自分ルールとの兼ね合い？　的な？,"I have my personal boundaries, and I gotta
stick to them? Something like that."
0000000000000,プロデューサー,……真面目すぎるんだ、結華は,"You might be taking this stuff too seriously, Yuika..."
2007007110230,結華,あは、それはプロデューサーに言われたらやばいやつだねぇ,"Aha... Must be reeeally baad if you're saying
that, Producer."
2007007110240,結華,"……で、今みたいに自分勝手に話すくせして、
最後まで踏み込めないように自分から一歩引いちゃうのとか","...I'm telling you this stuff now and putting 
it out there on my terms, so that you can't
cross the line to find out for yourself..."
2007007110250,結華,……ずるいなって、思うの,"...It's unfair of me, I think."
0000000000000,プロデューサー,…………,......
2007007110260,結華,……ね、もう踏み込めないでしょ？,"...Now then, there shouldn't be anything left
for you to pry about, right?"
2007007110270,結華,……ごめんね、プロデューサー,"...Sorry, Producer."
0000000000000,プロデューサー,"……もし、結華がそう思ってるんだとしても、だ
俺は結華のしたことが、ずるいことだとは思わない","...Even if that's how you see it, I don't think it's
unfair at all telling me about your personal
boundaries, Yuika."
0000000000000,プロデューサー,むしろ、結華について教えてもらえて──,In fact... I appreciate you for telling me this.
0000000000000,プロデューサー,"プロデューサーとして頼ってもらえてるって
気持ちになれるから、嬉しいくらいだ","It shows me that you're willing to depend on me as
a producer. And that makes me especially happy."
0000000000000,プロデューサー,だから少なくとも、俺に対してはずるくない,In the very least.. I don't think it's aggravating.
2007007110280,結華,────,────
2007007110290,結華,"それは──……
プロデューサーがずるいねぇ","That's───...
Maybe you're the aggravating one, huh?"
0000000000000,プロデューサー,"はは……
どっちかっていうと、そっちの方がいいな","Haha...
If it has to be one of us, I'd rather it be me."
0000000000000,プロデューサー,"……それで？
他には苦手なもの、ないのか？","...So what else you got?
Is there anything else that you despise?"
2007007110300,結華,…………,......
2007007110310,結華,あとは、多分──……,There's... probably...
2007007110320,結華,…………,......
2007007110330,結華,──ない,...nothing else~
0000000000000,プロデューサー,……今、踏み込んでいいか？,...Do you mind if I pry about that?
2007007110340,結華,えーダメだよ、ないって言ってるんだから,"Ehhh, you can't do that!
I said there's nothing else!"
2007007110350,結華,"っていうかプロデューサー、三峰の苦手なこと、
『踏み込まれること』だったらどうするつもり？","Like, what will you do if it turns out that prying
is what Mitsumine hates the most?"
0000000000000,プロデューサー,その可能性があるから許可取ろうとしたんだろ,"Well, that's why I was asking for permission."
2007007110360,結華,あはは、やっぱ真面目～,"Ahaha, what a serious answer~"
2007007110370,結華,"……でもダメだよ、踏み込んじゃやだ
それに、プロデューサーだったら大丈夫","But really... You don't... need to know that.
Besides, if it's you, Producer... Then it's fine."
0000000000000,プロデューサー,？,?
2007007110380,結華,"三峰が一番苦手なことは、多分──プロデューサーだったら
絶対にやらないんだろうなって思うから","Because... Mitsumine firmly believes that you won't
ever do the thing that she hates the most."
2007007110390,結華,"だってプロデューサー、三峰のことよく見てくれてるもん
……だから、大丈夫","You've always been paying close attention to me...
That's why... I don't need to say it. It's fine."
info,produce_events/200700711.json,
Translator,Lewdacriz,
