id,name,text,trans
4001014020010,あさひ,"来月から新発売の化粧品っす～！
ちょっと試していかないっすかー？",New cosmetics going on sale next month! Do you wanna try some samples?
4001014020020,冬優子,"夏のお出かけにもぴったりな、
爽やかなお色のリップです！","A fresh new lipstick color, perfect for going out in summer!"
4001014020030,冬優子,"今ならすぐお試しいただけますよ～
スキンケア用品の試供品もお配りしています♡",We have samples for you to try right now~! And we're also handing out other skin care products as gifts♡
4001014020040,冬優子,…………っていうか,"...Say,"
4001014020050,冬優子,これ、アイドルの仕事なわけ……？,Is this an idol's job...?
4001014020060,あさひ,冬優子ちゃーんっ,"Fuyuko-chan,"
4001014020070,あさひ,冬優子ちゃん、試供品配り終わったっすか？,"Fuyuko-chan, are you done handing out samples?"
4001014020080,冬優子,"ううん、まだまだ
あさひちゃんは？","No, not yet.
Are you?"
4001014020090,あさひ,なくなっちゃったんで、補充してもらいにいくっす！,"I'm totally out, I'm off to get refills!"
4001014020100,冬優子,は、早いんだね……！,S-So fast...!
4001014020110,あさひ,"さっきちっちゃい子がたくさん来て
全部あげちゃったんすよね","A bunch of little kids just came by and
grabbed up everythin'!"
4001014020120,冬優子,ええっ……！？,Eh...!?
4001014020130,あさひ,"お母さんとか、保育園の先生？　に
プレゼントするって言ってたっす！","And they said, they'll give it to their moms, or nursery school teacher? As a present!"
4001014020140,あさひ,だからサービスしたっすよ！,So I gave it to them for free!
4001014020150,冬優子,"そうだったんだ
それはきっと喜んでくれてると思うけど……","Oh, that's what happened.
They must have been happy about that..."
4001014020160,冬優子,"でも……
ちょっと、気を付けた方がいいかも……？","But, umm... Don't you think, maybe, you should've been a little more careful about that... ?"
4001014020170,あさひ,"？　なんでっすか？
欲しがってる人にあげるのが一番っすよね？","Hm? Why's that? Isn't it most important to give
people what they want?"
4001014020180,冬優子,それはそうなんだけど,"That's true, but..."
4001014020190,冬優子,"でも、同じ人にたくさんあげちゃったら、
その分渡せる人が少なくなっちゃうでしょう？","Well, if you gave a lot of samples to the same person, you wouldn't be able to give them out to as many people, right?"
4001014020200,冬優子,"ふゆたちは、商品と、スポンサーの会社さんを
効果的に広めるためにお仕事をしてるわけだから","We've been called to do this job to spread the word about these products, and the sponsor company, as widely and effectively as possible."
4001014020210,冬優子,そういうことも考えなくちゃいけないと思うの,"I think we have to be concerned about things like
that."
4001014020220,あさひ,"なるほど……？
そういうもんっすか……","Oh really...?
Is that the way it is?"
4001014020230,あさひ,わかったっす、気を付けるっす,Got it! I'll take care of it!
4001014020240,冬優子,うん、ありがとう……！,"Mhm, thanks...!"
0000000000000,責任者,"──やあ
やってるね","──Wow.
You guys are working hard, aren't you?"
4001014020250,冬優子,"わっ……！？
お疲れ様ですっ","Huh...!?
Thank you very much──"
4001014020260,あさひ,……冬優子ちゃん、この人誰っすか？,"...Fuyuko-chan, who's this?"
4001014020270,冬優子,"あさひちゃん！
現場の責任者の方だよ、ほらちゃんとご挨拶を──","Asahi-chan! He's the supervisor here,
so come and greet him properly──"
4001014020280,あさひ,"責任者さんってことは、
この化粧品については知ってるってことっすよね！","Since you're the person in charge here,
you must know about these cosmetics, right!"
0000000000000,責任者,ああ、そうだよ,"Ah, I do."
4001014020290,あさひ,"じゃあ、宣伝する必要はないっすね！
わたし、向こうで声かけてくるっす！","Well then, there's no need to advertise to you!
I'll go chat with those people over there!"
4001014020300,冬優子,あさひちゃん！？,Asahi-chan?!
0000000000000,責任者,っく、ははは……！,"Pf, hahaha...!"
4001014020310,冬優子,"すっ、すみません……！
きちんとご挨拶もしないで……！","S-Sorry...!
She didn't greet you properly!"
0000000000000,責任者,"いやいや、構わないさ
元気のいい子だなぁ","No, no, I don't mind.
She's quite a lively kid."
4001014020320,冬優子,"本当にすみませんっ……！
後でよく言っておきますからっ……","I'm really sorry...!
I'll have to talk to her properly later..."
0000000000000,責任者,"ああいう子も必要だよ
面白いねぇ","A kid like that is indispensable.
She's interesting, isn't she?"
4001014020330,冬優子,～～っ……！,......!
0000000000000,責任者,"……君も、あの子に負けずに頑張ってね
よろしく頼むよ","...And you, do your best not to lose to that kid.
Thanks in advance."
4001014020340,冬優子,は、はいっ……！,Y-Yes...!
0000000000000,責任者,それじゃあ,"Well then, I'm off."
4001014020350,冬優子,……,......
4001014020360,冬優子,……はぁ……,...Hah...
4001014020370,冬優子,なんでふゆが……,Why me...
4001014020380,冬優子,なんでふゆが、こんな思いしなきゃなんないのよ……,Why do I have to be made to feel this way... ?
4001014020390,あさひ,ティッシュ配りの人の気持ちがわかったっす！,I kinda get what it's like to be those people that hand out tissues!
4001014020400,あさひ,"このお仕事って、あと何回かやるんすよね？
次も楽しみっす～","We're gonna do this job a few more times, right?
I can't wait for the next one~!"
4001014020410,冬優子,"……ごめんね、あさひちゃん
ちょっといいかな","...Excuse me, Asahi-chan.
Can I have a moment?"
4001014020420,あさひ,"？
どうしたっすか？","Hmm?
What's up?"
4001014020430,冬優子,"あのね、今日のあさひちゃんを見てて思ったんだけど……
──もう少しだけ、まわりを見てくれたら嬉しいなって","Well uhm, I was thinking while assessing Asahi today, 
but... ──it'd be great if you could pay attention to
your surroundings, just a little more."
4001014020440,あさひ,……どういうことっす？,...What do you mean?
4001014020450,冬優子,"今日、責任者の方に挨拶しなかったでしょう？
そういうのって、あんまりよくないことだと思うの","Today, you didn't greet the supervisor right?
Stuff like that, I think isn't really so good."
4001014020460,冬優子,あさひちゃんはアイドルなんだもん,"After all, you're an idol, Asahi-chan."
4001014020470,冬優子,"あさひちゃんを見て、お仕事をくれる人たちのこと──
もう少し、意識しなくちゃ",And people like him are the ones watching you and thinking of giving you jobs── So you should be a little more conscious of that.
4001014020480,あさひ,……,......
4001014020490,あさひ,"でも、商品と会社を知ってもらうのが大事だって
冬優子ちゃん、言ってたっす","But the most important thing is for people to know the company and the products. That's what you said, Fuyuko-chan!"
4001014020500,あさひ,わたし、それはすごくわかったっすよ！,I really understood it!
0000000000000,あさひ,でも、責任者の人とおしゃべりするのは違う気がするっす,"But, chit-chatting with the supervisor feels like a
different thing!"
4001014020510,冬優子,"それは──……
時と場合っていうものがあって──","That's...
There's a time and a place for it──"
4001014020520,あさひ,……,......
4001014020530,冬優子,……,......
4001014020540,冬優子,"……ふゆが言ったこと、
真剣に受け止めてくれたのはありがとう","...But, what Fuyu said,
thanks for taking it seriously..."
4001014020550,冬優子,"……でも、もしあさひちゃんが
責任者の人からよく思われなかったら","...But, Asahi-chan, if you don't leave a good impression on the supervisor too, then..."
4001014020560,冬優子,"その次のお仕事が
来なくなっちゃうかもしれないでしょう？",Maybe he won't think to give other jobs to you in the future.
4001014020570,あさひ,"……お仕事をちゃんとこなしていれば、
認めてもらえるんじゃないんすか？","...If you do your job well,
won't that be enough to be noticed?"
4001014020580,冬優子,"……
違うよあさひちゃん……","......
That's not it, Asahi-chan..."
4001014020590,冬優子,"みんなから愛されなかったら──
応援してくれる人がいなくなっちゃったら","If you're not loved by everyone──
If no one is there cheering for you,"
4001014020600,冬優子,アイドルはダメになっちゃうんだよ……？,Isn't it pointless to be an idol...?
4001014020610,あさひ,……,......
4001014020620,あさひ,……だから、我慢しておしゃべりするんすか？,"...So, you have to control yourself and chit-chat?"
4001014020630,冬優子,……意地悪な言い方かもしれないけど、そう,"...That's a mean way of putting it but, yeah. "
4001014020640,冬優子,"ふゆたちはアイドルだから、めいっぱい可愛くして、
もっと話したいなって思うような子にならなきゃ","We're idols, so we have to become even cuter, so that other people will want to talk with us even more."
4001014020650,冬優子,"あさひちゃんだって、
みんなから好かれたいでしょう？","I mean, don't you want to be loved by everyone too, Asahi-chan?"
4001014020660,あさひ,"それは相手の自由でいいと思うっす
嫌いならそれはそれでいい",I think it's up to them to decide if they like me or not. I don't mind if they hate me either.
4001014020670,あさひ,好かれなきゃって思って振る舞うのは、面倒っす,It's a pain to act a certain way just to be liked by other people.
4001014020680,あさひ,冬優子ちゃんは違うんすか？,"Is that wrong, Fuyuko-chan?"
4001014020690,冬優子,あさひちゃん……,Asahi-chan...
4001014020700,冬優子,……,......
4001014020710,あさひ,……,......
4001014020720,あさひ,"……違ってたら、今度また教えてほしいっす！
また明日っすよ、冬優子ちゃん","...If I'm wrong, please teach me again!
See ya tomorrow, Fuyuko-chan!"
4001014020730,冬優子,"え！？
ちょっと、あさひちゃん待って──","Eh!?
Hey, wait Asahi-chan──"
4001014020740,冬優子,あ……,Ah...
4001014020750,冬優子,"……だから、なんなのよ……！
あいつは……！","...Urgh, what's even up with her...!
That stupid kid...!"
4001014020760,あさひ,おはようっす～,Morning～
4001014020770,冬優子,おはようございます♡,Good morning♡
0000000000000,スタッフ,"おっ、あさひちゃんだ
おはよう、今日もじゃんじゃん配ってね～","Oh, Asahi-chan! Morning! Make sure you hand out lots of stuff today too, okay?"
4001014020780,あさひ,"はいっす！
任せといてほしいっす！","Yeah!
Just leave it to me!"
0000000000000,スタッフ,君も！　よろしく頼むよ！,And you over there! Do your best today!
4001014020790,冬優子,"は、はいっ！
精いっぱい頑張ります……！","Y-Yes!
I'll do my very best...!"
4001014020800,冬優子,……,......
0000000000000,責任者,──おや、芹沢さんだね,"──Oh, Serizawa-san, now was it?"
4001014020810,あさひ,──……責任者さんっす！,──...Mr. Supervisor!
0000000000000,責任者,はは、覚えていてもらえて光栄だ,"Haha, I'm honored you remember me."
0000000000000,責任者,"芹沢さんの声がけね、気持ちがいいって、
お客様にも評判なんだよ","The customers have all been saying
that they love hearing your voice."
4001014020820,あさひ,ほんとっすか！？,Really?!
0000000000000,責任者,"この調子で頑張りなさい
期待しているから","Keep up that attitude.
I have great expectations."
4001014020830,あさひ,はいっす！,Yes!
4001014020840,冬優子,──……,......
0000000000000,責任者,ああ、芹沢さんと一緒に来ている子だね,"Ahh, you're the girl who came with Serizawa-san,
right?"
4001014020850,冬優子,"はい──
あの、おはようございますっ……","Yes.
Uhm, good morning..."
0000000000000,責任者,"おはよう
君も、今日も頑張るんだよ","Morning.
Do your best today as well."
4001014020860,冬優子,は、はいっ,Y-Yes...
0000000000000,責任者,それじゃあ,I'm off.
4001014020870,冬優子,あの──！,Uhm!
0000000000000,責任者,？,Hm?
4001014020880,冬優子,"……いえ、なんでもないんです
引き止めてしまってすみません……","...No, it's nothing.
Sorry for keeping you..."
0000000000000,責任者,そうか,I see.
4001014020890,冬優子,……,......
4001014020900,冬優子,"……『ふゆっす！
今日もよろしくお願いするっす！』","...""Hiya, I'm Fuyu-su!
I'm gonna do my best today!"""
4001014020910,冬優子,……,......
4001014020920,冬優子,……何やってんだか,...What am I doing?
4001014020930,冬優子,バカみたい……,I look absurd...
info,game_event_communications/400101402.json,
Translator,,
