id,name,text,trans
4001014060010,冬優子,──それでは,"-now then,"
4001014060020,冬優子,"『海辺のアイドルバトル』について
作戦会議、始めよっか！",Let's start our 'Seaside Idol Battle' strategy meeting!
4001014060030,愛依,おーっ,Ohhh!
4001014060040,冬優子,"まずはルールの確認からね？
……念のためだけど、やりすぎってことはないと思うし","First of all, let's check the rules... just in case, but I don't think there's too much to do."
4001014060050,愛依,"助かるわー
うち、物覚え悪いからさぁ","We're saved- I never remember anything, so."
4001014060060,あさひ,"ルール覚えとかないと、
どんなゲームも動けないっすからね","If you don't remember the rules to any games, you can't play them, right?"
4001014060070,冬優子,えー、こほん,Eh- *Ahem*.
0000000000000,冬優子,それじゃあいくね,Then shall I start?
4001014060080,冬優子,"今回のバトルは、ユニット対抗です
ただし、バトル自体は個人単位で行います","This battle is a unit competition. However, the battle itself will be done on an individual basis."
4001014060090,愛依,"おお……？
さっそくわからんやつ……",Ohh...? I'm already lost...
4001014060100,冬優子,"えっとね、ユニットの中でそれぞれ、
ボーカル担当、ダンス担当、ビジュアル担当を決めるの","Well, within each unit, you'll decide someone in charge of vocals, dance, and visuals."
4001014060110,あさひ,うちは３人ユニットだから、ちょうどいいっすね,"We're a three person unit, so it's just right."
4001014060120,冬優子,そういうことだね,You could say that.
4001014060130,冬優子,"──それで、担当ごとにひとりずつパフォーマンスを
見せて、お客さんたちに投票してもらうんだって","-So then, there's one performance for each person. The guests watch and then vote."
4001014060140,冬優子,"各担当の点数の合計が、ユニットの得点になるの
もちろん、合計得点が高かったユニットが優勝だよ","The combined scores of each person is the score of the unit. Obviously, the unit with the highest score wins."
4001014060150,愛依,えーっとつまりは……,Uhm so in other words...
4001014060160,愛依,"あさひちゃんと冬優子ちゃんがすごくても、
うちが足引っ張ったら台無しになるってこと……！？","Even if Asahi-chan and Fuyuko-chan are amazing, if I drag you down I could ruin it...!?"
4001014060170,あさひ,ルール上はそうっすね！,That's the rules!
4001014060180,愛依,"うわあぁぁ……！
きっつ～～！！　鬼かっつの！",Wahhhhh...! So strict~~!! It's a demon competition!
4001014060190,あさひ,そんな心配しなくても大丈夫っすよ～,It'll be fine so don't worry about that~
4001014060200,冬優子,"あさひちゃんの言う通りだよ
みんなで頑張ろう？　愛依ちゃん",Asahi-chan is right. We'll all do our best okay? Mei-chan.
4001014060210,愛依,でも、うちステージじゃあがっちゃうし……,"But, we're going to be up on stage..."
4001014060220,冬優子,"そしたら、愛依ちゃんは
ビジュアル担当になるのはどうかな？","Well then, how does Mei-chan feel about being in charge of visual?"
4001014060230,冬優子,"歌ったり踊ったりするより、
少し気が楽になったりしない？","Instead of singing or dancing, doesn't that sound a little easier?"
4001014060240,愛依,"た、確かに。それだったら、
頑張れば足引っ張らずに済むかも……！？","C-Certainly. Then, if I do my best, I might not drag you down...!?"
4001014060250,愛依,う、うち、ビジュアル担当でもいいかな……！？,I-Is it really okay for me to take visual...!?
4001014060260,あさひ,"いーっすよ！
わたしがやりたいのはダンスだし──",It's fine! Since the one I want to do is dance-
4001014060270,冬優子,あさひちゃん、ダンスがいいんだ？,"Asahi-chan, you're okay with dance?"
4001014060280,あさひ,"そうっす！
ステップが上手く決まると気持ちいいっす！",Yeah! It feels great when the steps work out well!
4001014060290,冬優子,"わかった、じゃああさひちゃんがダンス担当で、
愛依ちゃんがビジュアル担当──","Got it. Well then with Asahi-chan on dance, and Mei-chan on visual-"
4001014060300,冬優子,ボーカルはふゆが頑張ります！,Fuyu will do her best with vocals!
4001014060310,あさひ,"この後の練習はどうするっすか？
担当も決まったし、個人？","Should we do some practice after this then? With the roles we decided, individually?"
4001014060320,愛依,"はいはいはいっ！　ちょい待って！
うち、もうちょっとアドバイスとか聞いときたい！",Yes yes yes! But wait a sec! I'd like to get a little bit more advice first!
4001014060330,愛依,ふたりがすごいのはわかってんだもん,I know the two of you are amazing after all.
4001014060340,愛依,"本番で迷惑かけたら困るから、
まだ付き合ってほしい！　今迷惑かけさせて！","Since it'll be a problem if I cause trouble during a real performance, I still want to go with you! Let me bother you this time!"
4001014060350,あさひ,"愛依ちゃんは心配性っすねー
そんなカタく考えなくても平気っすよ～",Mei-chan's a bit of a worrier huh- You'll be fine if you don't think about that stuff~
4001014060360,あさひ,"音楽に合わせて出てって、
キメて帰って来ればオッケーっす！","Come out when you hear the music, and then you're okay to head back!"
4001014060370,冬優子,"そうだね、この間のステージの愛依ちゃんが出せれば
全然問題ないと思うな","That's right, if Mei-chan can come out on stage during this, I don't think there'll be any problem at all."
4001014060380,冬優子,"あとは──……テレビ局がスポンサーの企画だから、
テレビ受けを意識してみるとか──","Also-... since the TV station is sponsoring this event, try to be aware of where the TV camera is-"
4001014060390,愛依,テレビ受け？,TV camera?
4001014060400,あさひ,……,......
4001014060410,冬優子,"うん、イベント自体の結果ももちろん大事だけど、
関係者さんたちにもいい印象を残せたらもっといいでしょ？","Mhm, naturally the results of the event itself are important, but leaving a good impression on the staff at the event might be even moreso, right?"
4001014060420,愛依,それはそうだよね……！,So that's how it is...!
4001014060430,冬優子,だからこう、可愛くにこって笑うようにしてみるとか──,"That's why, try to do things like a cute smile-"
4001014060440,愛依,"や、ごめん冬優子ちゃん、
うちそういうのあんまり得意じゃなくて──","Yah, sorry Fuyuko-chan, I'm really not good that stuff like that-"
4001014060450,冬優子,"大丈夫だよ！
愛依ちゃんとっても可愛いんだから！",You're okay! Mei-chan's super cute after all!
4001014060460,冬優子,"お姫様になった気持ちで、
ふわふわしてキュートな感じをイメージするの！","You feel like a princess, giving off an image that's so fluffy and cute feeling!"
4001014060470,冬優子,"カメラさんとか、目が合ったお客さんに、
『大好き♡』って気持ちでウインクして──","The cameraman, and guests who catch your eye, just give them a wink that says 'I Love You♡'-"
4001014060480,冬優子,ハートをいっぱい飛ばすつもりでやるんだよっ,Do it with the intention of making lots of hearts fly out.
4001014060490,愛依,あー、え、えっと～……,Ah- U-Uhm~...
4001014060500,あさひ,"……冬優子ちゃん
愛依ちゃんにそういうのは、違わないっすか？","...Fuyuko-chan. When it comes to Mei-chan, isn't she different?"
4001014060510,冬優子,え……？,Eh...?
4001014060520,あさひ,"無理して作ったら嘘になっちゃうっす
それじゃあ愛依ちゃんじゃないっすよ",If you force it then it'll just end up being a lie. If she did that she wouldn't be Mei-chan.
4001014060530,冬優子,あ……,Ah...
4001014060540,冬優子,"ご、ごめんね愛依ちゃん……！
無理してほしいとか、そういうつもりじゃなくて……！","S-Sorry Mei-chan...! I don't want you to force it, it wasn't like that...!"
4001014060550,冬優子,"ふゆ、愛依ちゃんのファンが増えたら嬉しいなぁって、
そう思っただけなの……！","Fuyu, just wanted Mei-chan to get more fans, that's all I was thinking about...!"
4001014060560,愛依,いや、うちは全然気にしてないし──！,"Oh, I wasn't bothered at all-!"
4001014060570,あさひ,"いつもの愛依ちゃんから何か変えなくても、
すごいパフォーマンスができれば、ファンは増えるっすよ！","Even if you don't change at all from the usual Mei-chan, if you give an amazing performance, you'll get more fans!"
4001014060580,あさひ,だから愛依ちゃんは大丈夫っす！,So Mei-chan'll be fine!
4001014060590,冬優子,──……,--...
4001014060600,冬優子,"……もちろん、
そういうふうに上手くいくのが一番だけど──","...Of course, if it goes well like that it'd be best, but-"
4001014060610,冬優子,"アイドルだもん、ファンサも大事にする必要があると思うの
愛される努力は忘れちゃダメっていうか……","As idols, it's also necessary to consider our important fanservice. You can't forget to put in effort to be loved..."
4001014060620,あさひ,"？
そのままの自分を好きになってもらうんじゃダメなんすか？",? Isn't it bad if they don't like you for the way that you already are?
4001014060630,冬優子,……っ,...tch.
4001014060640,あさひ,"別に、嘘をつかないと好きになってもらえない
ってわけじゃないっすよね？","Besides, you're not saying that they won't like you if you don't lie, right?"
4001014060650,あさひ,"だったら、好きになってもらえるように
無理するんじゃなくて",So then you shouldn't lie in order to force them to like you.
4001014060660,あさひ,"無理しなくても好きになってもらえるのが
一番なんじゃないんすか？",And I think you'll like it if you're not forcing it too. Isn't that the best?
4001014060670,冬優子,……,......
4001014060680,冬優子,"……あさひちゃん、すごいな
ちょっとうらやましくなっちゃう","...Asahi-chan, you're amazing. I'm a little bit envious."
4001014060690,冬優子,あさひちゃんの考え方は、まっすぐだと思うよ,The way Asahi-chan thinks is so straightforward.
4001014060700,冬優子,"……でもね
あさひちゃんにはわからないかもしれないけど","...but, well. Asahi-chan may not quite understand."
4001014060710,冬優子,誰でも、あさひちゃんみたいに振る舞えるわけじゃないの,Not everyone can behave the way that Asahi-chan does.
4001014060720,冬優子,"……みんながあさひちゃんみたいに
強いわけじゃないんだよ","...in order to be like Asahi-chan, some people just aren't that strong."
4001014060730,あさひ,……そんなわけないっす,...that's not true.
4001014060740,冬優子,だから、あさひちゃんには──,"That's why, for Asahi-chan-"
4001014060750,あさひ,"そんなわけないっすよ！
だって──",That's not true! Because-
4001014060760,あさひ,たくさん我慢できる人は強い人っす,People who can endure a lot are strong!
4001014060770,あさひ,……違うっすか？,...am I wrong?
4001014060780,冬優子,……,......
4001014060790,冬優子,……ふゆは違うと思う,...Fuyu thinks differently.
4001014060800,あさひ,……,......
4001014060810,あさひ,"そうっすか
じゃあ、間違えたっす","Is that so. Well, then I'm mistaken."
4001014060811,あさひ＆冬優子,……,......
4001014060820,愛依,……,......
4001014060830,愛依,……や、ふたりともやっぱすごいわ,"...yeah, you two really are amazing."
4001014060840,冬優子,え……,Eh...
4001014060850,愛依,うち、ホントにまだアイドルのこと全然わかってなくてさ,I'm still completely lost on what an idol really is.
4001014060860,愛依,"ふたりみたいに、『こうあるべき！』みたいなやつ、
思いつきもしないんだよね","The two of you are like, ""this is how it is!"" it seems, and I haven't even thought about it."
4001014060870,あさひ,別にそういうんじゃないっすけど……,It's not really like that though...
4001014060880,愛依,"いやいやいや、そんなことはないから
うちにはできないやつだから","No, no, no, it's not like that but, it's something I can't even do."
4001014060890,愛依,"こういうの堂々と自分で言っちゃうのも
ダサいなって思うんだけど……","I couldn't even talk about it myself, it'd be totally tacky to do..."
4001014060900,愛依,"でもマジで！　ふたり、スゲーかっこいいなって思った！
プロってカンジだった！","But seriously! The two of you, I think you're super cool! You already feel like pros!"
4001014060910,愛依,"ドラマとかでもさ、
アイドルは人気商売って言うじゃん？","Even in like Dramas, idols are a hot commodity, right?"
4001014060920,愛依,"だから冬優子ちゃんの、
サービス精神旺盛に～ってのもわかる気がすっし",So Fuyuko-chan's service-oriented approach is like~ I totally get it.
4001014060930,愛依,"でも、うちがそんなことしたら自爆すんじゃね感も
すごいから、あさひちゃんの言うことももっともだし","But, I feel like if I tried that I'd just end up tripping over myself spectacularly so, what Asahi-chan's saying feels better for me."
4001014060940,愛依,"ふたりともうちのことよく見てくれてるっつーか、
アイドルとして分析？　みたいなのができてるっつーか","The two of you can see it a lot better than me, analyzing an idol? I don't think I can do that."
4001014060950,愛依,どっちもガチだな！　って思っちゃったよね,Both of them are totally legit! Is what I was thinking.
4001014060960,あさひ,……そうっすか？,...you think so?
4001014060970,冬優子,……だったら、よかったけど……,"...if that's the case, I'm happy but..."
4001014060980,愛依,"だからうち、ふたりの話聞いて、
できそうなところをマジで頑張るね","So when I listen to the two of you, I really want to give my all so I can do that."
4001014060990,愛依,"欲張りすぎたらぜってーコケると思うからさ、
そうならないように、足引っ張らないように","I think if I'm too greedy about it I'll definitely flop, so in order for that to not happen, I'll make sure not to drag you down."
4001014061000,愛依,"今のうちの、全力で！
ハンパしないでやりきってみせるから！","So now, with all my might! So that I can do it all without holding you back!"
4001014061010,愛依,ありがと、ふたりとも！,"Thanks, you two!"
4001014061011,あさひ＆冬優子,……,......
4001014061020,あさひ,──はいっす！　応援してるっすよ！,--Yeah! I'll support you!
4001014061030,冬優子,"うんっ
一緒に頑張ろうね♡","Yeah, let's do our best together♡"
info,game_event_communications/400101406.json,
Translator,,
