id,name,text,trans
0000000000000,プロデューサー,やったな、夏葉。無事……合格だ！,"You did it, Natsuha. You passed with flying colors!"
5013001000210010,夏葉,うふふ、今までの成果が出たわね,"Ufufu, it's just like what I did before."
0000000000000,プロデューサー,ああ、心にも余裕を持てているようだな,"Yeah, I didn't doubt you for a second."
5013001000210020,夏葉,"そうね
でも、これは私ひとりの力じゃない","Of course, it wasn't won entirely by my own hand."
5013001000210030,夏葉,アナタのサポートがあるからよ,"You've been there supporting me, after all."
0000000000000,プロデューサー,"そう言ってくれると嬉しいよ
これからも一緒に頑張っていこう","It makes me happy to hear that from you.
Let's both keep doing our best together."
5013001000210040,夏葉,"……ありがとう、プロデューサー
頼りにしているわ。これからもよろしくね","...Thank you, Producer.
I'll keep on counting on you from on out."
info,produce_communication_auditions/501300100021.json,
Translator,,,vio
