id,name,text,trans
0,番組予告,"──金曜よる８時からは、
『SONG BY』２時間スペシャル──！","──At 8 PM this Friday,
it's the ""SONG BY"" 2-hour special──!"
0,番組予告,"テーマは『ミュージックシーンを変えたアーティスト』、
洋楽から邦楽まで音楽の歴史を振り返ります","The theme is ""Artists who Changed the Music Scene"",
where we'll be looking back at music history through 
Western and Japanese music."
0,番組予告,"また、…………の新曲をテレビ初披露
…………による、一夜限りのスペシャルコラボ──","The TV debut of the latest song from ......, and 
a one-night only special collaboration between ...... "
0,番組予告,"さらに、新世代アーティストを大特集
海外で人気沸騰の──、──、…………そして、番組初登場","Next, a big special feature on next-generation 
artists. The big star making international headlines, 
──, ──, ... and for the first time on this show... "
0,番組予告,『ストレイライト』,"""Straylight"""
0,プロデューサー,"冬優子、忙しいところ悪いな
ちょっとここだけ確認してもらえるか","Fuyuko, sorry to bother you when you're busy.
I just want you to check this part over."
4001033010010,冬優子,何？ ……雑誌？,What's that? ... A magazine?
0,プロデューサー,"ああ、特集の『今もっとも注目するアイドル』で、
冬優子の名前があがっていて……","Yeah, your name was brought up in this special feature,
""Notable Idols of Today""... "
0,プロデューサー,"ここのカコミで簡単に紹介されてる
問題ないよな？","There's a short introduction to you written in this box.
This alright with you?"
4001033010020,冬優子,"ふゆが許可することでもないでしょー
あんたが問題ないと思ったんならそれでいいわ","That's not something I need to give approval for, is it?
If you don't see any problems, then I'm fine with it."
0,プロデューサー,"ありがとう
それじゃ連絡しておく","Thanks.
I'll go let them know then."
4001033010030,冬優子,──あ、待って。ひとつだけ確認させて,"──Ah, hold it. Let me check just one thing."
4001033010040,冬優子,"どこの雑誌？
アイドル系じゃなさそうだけど──","What magazine is this?
It doesn't look like an idol magazine──"
0,プロデューサー,"ああ、写真の専門誌とのことだ
各分野のカメラマンにインタビューする特集みたいで──","Yeah, it's a photography journal.
It seems like this issue features interviews with 
photographers in various fields──"
0,off,……君は笑顔を作るのは上手いよ,...You're good at putting on a smile.
4001033010050,冬優子,！ この名前……,"! That name... "
0,off,"でも、それはしょせん作り物だ
君の笑顔は本物じゃない","But it's still made-up in the end.
Your smile isn't genuine."
4001033010060,冬優子,……,"...... "
0,off,"ぐうの音も出ないくらい
完璧なふゆを見せてやるんだから！","I'm gonna show him a Fuyu 
so flawless it'll leave him speechless!"
0,雑誌のゲラ,"『今もっとも注目するアイドル』
『黛 冬優子（ストレイライト）』","""Notable Idols of Today""
""Fuyuko Mayuzumi (Straylight)"""
4001033010080,冬優子,ふふ……,"Hehe... "
4001033010090,冬優子,あはは……！,Ahaha... !
0,プロデューサー,あさひ──！,Asahi!
4001033010100,あさひ,ん……？,Hmm... ?
0,プロデューサー,"はあ、急に走らないでくれ……
どうしたんだ？","Haa, don't just run ahead like that... 
What's wrong?"
4001033010110,あさひ,あれ見てたっす,I was looking at that.
0,プロデューサー,"街頭モニター？
……ああ、このCM──","The street screen?
... Oh, this commercial──"
0,off,"さっきのダンスって、
モニターで流れてたやつだよね？ 練習してたの？","The dance you just did, it's the one from the 
commercial that aired just now, right? Were you 
practicing it?"
0,プロデューサー,あさひと最初に会った時に流れてたCMだな,That's the ad that was playing when we first met.
4001033010120,あさひ,……？ あー……,"... ? Ahh... "
0,off,"ちょっとやってみただけっすよ
楽しそうだったんで！","It looked a lil' fun, 
so I gave it a shot!"
4001033010130,あさひ,これ、あの時と同じCMっすか？,Is it the same ad from then?
0,プロデューサー,そうだよ,That's right.
4001033010140,あさひ,ふーん……,"Hmmm... "
4001033010150,あさひ,こんなのだっけ,Did it go like this?
0,愛依の妹,"あ、お姉ちゃん！
これお姉ちゃんのってる！","Hey Big Sis!
You're on this one!"
4001033010160,愛依,"お～？ アハハ、懐かしいやつじゃん
ったく、どっから引っ張り出してきたん～？","Oh～? Ahaha, sure brings back memories.
Hey now, where'd you even pull that one from～?"
0,愛依の妹,"えへへ……ごーるでんあいどるふぇすでみせた
ストレイライトのあたらしいかたち","Eheheh... The new ver-sion of Straylight
re-veel-ed at the Gol-den Idol Fehs-tee-vul."
0,愛依の妹,あたしたちは……あたしたちは……つよ……,"We are... We are... the strong... "
4001033010170,愛依,『あたしたちは最強のライバルで、最強のユニットだから』,"""We are the strongest rivals and the strongest unit."""
0,愛依の妹,ん……！ これはなんて読む？,Uh-huh... ! What does this say?
4001033010180,愛依,"これはね～、あたら……ん？ 違うな～……
しん……しんしん……？","This one is～, upend...hmm? That's not it～... 
Up... Upcoming... ?"
0,愛依の妹,お姉ちゃんも読めてない～！,"You can't even read it either, Sis～!"
4001033010190,愛依,"待ち待ち……！
あ、しんしんきえいだ！ 新進気鋭！","Wait wait...!
Ah, ""up, and, coming""! Up-and-coming!"
0,愛依の妹,"あはは……ステージだとかっこいいのに、
おうちだと全然ちがうね～","Ahaha... You're so cool on stage,
but at home you're sooo different～"
4001033010200,愛依,"残念でした～
ホントのうちはこっちだかんね","Too bad～
This is the real me."
0,off,人前に出てライト浴びたら頭真っ白になって……,"My head just goes blank when the spotlight 
hits me in front of a crowd..."
4001033010210,愛依,でもステージでは,"But on stage... "
0,off,"無口な人はミステリアスだなって、
思ったりしないか？","A silent person is enigmatic, 
don't you think so?"
4001033010220,愛依,魔法にかかんの,... I cast a magic spell.
0,off,うちとプロデューサーで作ったアイドル,The idol made by me and Producer.
4001033010230,愛依,最強の和泉愛依に変身する魔法,A spell that turns me into the coolest Mei Izumi.
4001033010240,愛依,ちちんぷいぷーい、って！,"It goes ""Chi chin pui puuui""!"
0,愛依の妹,きゃー！ あはは──！,Kyaaa! Ahaha──!
4001033010250,冬優子,──いい？,─Got it?
4001033010260,冬優子,"今回はゴールデンタイムの地上波
バラエティじゃない、音楽番組","We're on prime time terrestrial today.
Not a variety show, but a real music program."
4001033010270,冬優子,"共演者は実力派のアーティストばかり
つまり強敵しかいない……けど","The other performers are all high-level, accomplished
artists. In other words, we're surrounded by strong
rivals... however..."
4001033010280,冬優子,だからこそ、打って出るのよ,"No, that's why, we'll go all out."
4001033010290,冬優子,"アイドルにしては、なんて言わせない
一歩も引けをとらないパフォーマンスを全国に見せつけて","We won't let them say, ""You're good for an idol"".
We'll show the whole nation a performance that's
second to none."
4001033010300,冬優子,"放送が終わった後、
ストレイライトを知らない人なんていなくしてやるの","And once the broadcast is over, we'll make it
so that there's not a single person out there 
who doesn't know Straylight."
4001033010310,冬優子,……わかった？,... You got that?
4001033010320,愛依,……オッケー,... Okay.
4001033010330,あさひ,楽しみっす～,I can't wait～
4001033010340,冬優子,よし,Alright.
4001033010350,あさひ,わたしは負けない,I won't lose.
4001033010360,あさひ,わたしたちは、誰にも負けない,We won't lose to anybody.
4001033010361,一同,わたしたちは……,"We are... "
4001033010362,一同,ストレイライト──！,Straylight──!
4001033010370,冬優子,──まあ,─Well...
4001033010380,冬優子,甘かったのよね、結論から言えば,"... to get straight to the point, we were naive."
info,game_event_communications/400103301.json,
Translator,Rinka,
