id,name,text,trans
0000000000000,プロデューサー,果穂、合格おめでとう！,"Kaho, congratulations on passing the audition!"
5009001000210010,果穂,"プロデューサーさん、ありがとうございますっ
今日はなんだか、いつもより上手にできたかも……","Producer, thank you.
I might've done better today than I usually do..."
5009001000210020,果穂,"あたし……
もしかして、パワーアップしたんですかっ！？","I...
Could it be that I powered up?!"
0000000000000,プロデューサー,"ああ。果穂は練習に練習を重ねて成長して、
そしてこのオーディションに合格したんだ！",Yeah. It's because you kept on doing more and more lessons that you grew and passed the audition!
5009001000210030,果穂,"そうだったんですねっ
えへへ、あたしも……成長してるんだ……","Yeah, that's right.
Ehehe... I'm... growing too..."
0000000000000,プロデューサー,次は、強くなった自分をファンのみんなに見せてくるんだ！,Next you're going to show your fans how strong you've become!
5009001000210040,果穂,"はいっ！　ヒーローはいつだって、
前進あるのみ、ですっ！",Yes! Heroes always keep moving forward!
info,produce_communication_auditions/500900100021.json,
译者,,
