id,name,text,trans
0000000000000,プロデューサー,甘奈、おめでとう！,"Amana, congratulations！"
5014001000210010,甘奈,"やったやったっ！
えへへ、嬉しいなぁ","Hooray, hooray！
Ehehe, I'm really happy."
0000000000000,プロデューサー,"最近の甘奈はよくがんばってるからな
結果に繋がってよかった","Lately, Amana has really worked her hardest.
So, I'm glad you finally got the result you deserved."
5014001000210020,甘奈,"甘奈ね、ファンのみんなに喜んでもらおうって、
思ったからがんばれたんだよ☆","You see, Amana thought a lot about making her fans happy, so that's why she really did her best out there☆"
0000000000000,プロデューサー,"ああ、ファンのみんなに支えられて、
今の甘奈があるからな","Yeah, all the fans are cheering your sake, exactly because Amana is like this right now. "
5014001000210030,甘奈,"えへへ、だよね
よーし、この調子でもっともーっとがんばるからねっ☆","Ehehe, I guess that's right.
Okay, just like this, I have to work harder than ever～☆"
5014001000210040,甘奈,"これからもよろしくねっ☆
プロデューサーさん！","So please look after me～☆
Producer-san！"
info,produce_communication_auditions/501400100021.json,
译者,,
