id,name,text,trans
6021003060010,円香,"もういいですよね？
先に行きます","Is that all?
I'll take my leave first."
0000000000000,プロデューサー,お、おう……早足でどうした？,O-Oh... Why the rush?
6021003060020,円香,向こう、見て,Look over there.
0000000000000,プロデューサー,"ん？　ああ……
取材カメラが裏にも来ているのか","Hm? Ahh...
News cameras are at the backstage too, huh."
6021003060030,円香,はい,Yes.
6021003060040,円香,"舞台裏は感情のエンターテインメント
盛り上がるのはわかりますよ","I know that capturing emotions of the
backstage is exciting entertainment."
6021003060050,円香,手が届かない画面の向こうの話ならね,But only if you're behind an unreachable screen.
info,produce_events/602100306.json,
Translator,Mycstea,
