id,name,text,trans
4001007050010,果穂,"アンティーカのみなさん、
泥棒さんに負けてなかったですっ……！","L'Antica weren't defeated
by the thief!"
4001007050020,智代子,"ほんとだねー……！
ああいうの、機転が利くって言うんだよねぇ。すごいなぁ","They were amazing, weren't they?
They certainly had their wits about them."
4001007050030,樹里,"あれで泥棒も、
諦めてくれりゃあいーんだけど……","That thief should have
given up earlier."
4001007050040,凛世,…………,......
4001007050050,凛世,"利を見て進まざるは……
労るるなり……",If the enemy sees an advantage and makes no effort to secure it... then their soldiers are exhausted.
4001007050060,夏葉,孫子ね。同感よ、凛世,"From Sun Tzu's The Art of War? I agree, Rinze."
4001007050070,智代子,……？,Hmm?
4001007050080,智代子,"えと、ごめん……
凛世ちゃんはなんて……？","Huh?
Sorry, Rinze, but could you explain that again...?"
4001007050090,夏葉,"有利なことがわかっているのに攻めてこないのは、
敵が疲れ切っているから──","If the enemy sees that they have the upper hand but don't act, it means they are too exhausted to fight."
4001007050100,智代子,つ、つまり……？,A-And that means...?
4001007050110,夏葉,ここは打って出るべき、ということよ！,That's when you should attack!
4001007050120,夏葉,"このタイミングで何か仕掛けたいわ
泥棒なんてバカげた真似、やめさせるためにもね",This opportunity's too good to pass up. I'd like to give him a piece of my mind!
4001007050130,夏葉,策がある人、いるかしら？,Would anyone like to propose a plan of attack?
4001007050140,樹里,策っつったって……そんな簡単に──……,You make it sound so simple...
4001007050150,樹里,アタシらじゃ力任せってわけにもいかねーし……,We can't count on winning through force alone...
4001007050160,智代子,もっとこう、心に訴えかけるやつの方が向いてそうだよね！,Maybe appealing to his heart would be more effective?
4001007050170,智代子,"実家のおふくろさんが泣いてるぞ、とか、
取り調べの時に出てくるカツ丼みたいな……","""Your mother would cry if she knew!"", or ""You can have this katsu-don if you cooperate"", perhaps."
4001007050180,果穂,ちょこ先輩、刑事さんみたいです……！,Chiyoko-senpai's like a detective!
4001007050190,智代子,ありがとう、果穂,"Thanks, Kaho."
4001007050200,智代子,……でもさすがにカツ丼作る材料はないしなぁ……,Although we don't have any ingredients to make katsu-don...
4001007050210,果穂,う～……！,Uhhhhh!
4001007050220,凛世,……,......
4001007050230,凛世,"かつ丼はなくとも……
あたたかい……スープなら……","We may not have katsu-don,
but we do have warm soup..."
4001007050240,果穂,スープ……？,Soup...?
4001007050250,果穂,"あ！
さっきまで作ってた、クラムチャウダーのことですか！？","Oh! You mean the clam chowder
we made earlier!?"
4001007050260,凛世,はい……,Yes...
4001007050270,凛世,"この味……必ずや……
泥棒さんの心に……届きましょう……","I'm sure its taste will...
reach the thief's heart..."
4001007050280,樹里,"んー……まぁ、あったかいもんで
泣き落としすんのも悪くねーかもな","Going for the tearjerkingly heart-warming approach
might not be a bad idea."
4001007050290,智代子,"そういうことなら、
できる限りもっとアットホームな感じに……","In that case, we should make the thief feel as much at home as possible..."
4001007050300,智代子,"あ、手紙とかつけちゃう？
こんなことやめなさいって","Maybe we could leave a letter
asking him to stop."
4001007050310,果穂,──お手紙！,A letter!
4001007050320,果穂,はいっ！　あたし、書きたいですっ,Yay! I want to write it!
4001007050330,果穂,"夏に書いたお手紙、甜花さんがスッゴく喜んでたって、
千雪さんが教えてくれました！",Remember the letter I wrote for the summer stall? Tenka was super happy! Or so Chiyuki told me!
4001007050340,果穂,"それで甜花さん、甘奈さんと一緒に、
お返事をくれたんです！","Kaho, would you be willing
to write a letter even to a thief?"
4001007050350,果穂,"お手紙は、仲良しのきっかけです！
だから──だから……！","Letters are how friendships are kindled!
That's why...!"
4001007050360,夏葉,──果穂なら、泥棒が相手でも伝えられるかしら？,"Kaho, would you be willing to write a letter even to a thief?"
4001007050370,果穂,"はいっ！　悪いことはしちゃダメですって、
泥棒さんに伝えられるように、頑張ります！","Yes! I'll do my best to tell him
that doing bad things is wrong!"
4001007050380,夏葉,"名案だと思うわ
真っ直ぐな気持ちほど心に響くものはないもの","I think that's good advice. Nothing leaves a stronger impression than honest, direct feelings."
4001007050390,夏葉,"泥棒だって、
きっと改心するに違いないわ","Surely even a thief will feel
remorse upon reading that."
4001007050400,智代子,果穂が書くなら、効果も倍増しそうだしね！,"After all, the effect is doubled if Kaho writes it!"
4001007050410,樹里,直接よりは危なくねーしな,And less dangerous than sending a message in person.
4001007050420,凛世,では……,In that case...
4001007050430,夏葉,特製クラムチャウダーと特製お手紙の作戦でいくわよ！,Our specially made clam chowder and specially written letter shall form our winning strategy!
4001007050431,一同,おーっ！,Oooh!
4001007050440,智代子,"で、でも……
泥棒さん、どこに隠れてるんだろうね……？","B-But...
where could the thief be hiding...?"
4001007050450,樹里,"アンティーカが追い返した後から、
様子わかんねーもんな……","After L'Antica were driven away,
we haven't seen him since."
4001007050460,果穂,もう、おうちに帰ってたりしないでしょうか……？,"M-Maybe, he went home...?"
4001007050470,凛世,"いえ……
……恐らく……上の階に……","No...
I fear he still lurks on the floor above..."
4001007050480,夏葉,そうね……私も凛世と同意見よ,I agree.
4001007050490,夏葉,"３階から灯りが漏れてる
きっと倉庫にこもってるんだわ……","The third floor lights are on.
No doubt he's hiding in the storeroom."
4001007050500,智代子,う、上かぁ……,T-The floor above...
4001007050510,夏葉,……,......
4001007050520,夏葉,──行きましょう……！,Let's go!
4001007050530,果穂,……,......
4001007050540,智代子,……,......
4001007050550,樹里,……,......
4001007050560,夏葉,"そっと置いて、そっと帰る……
それで今回の目的は達成よ……頼むわね凛世……","Let's set it down quietly and leave... That's all we need to do... I'll leave it to you, Rinze..."
4001007050570,凛世,問題……ございません……,I do not foresee... any difficulty...
4001007050580,夏葉,後は手紙を──,"And the letter, too.."
4001007050590,智代子,ひっ……！？,Kya...!?
4001007050591,一同,キャーーーーーー！？！？,Ahhhhh!!
4001007050600,凛世,……,Hmm?
0000000000000,プロデューサー,"（……な、なんだ……？
果穂たちの声だったと思うんだが……）","(W-What was that...?
I thought I heard Kaho and the others scream...)"
0000000000000,プロデューサー,"（いない──か……
……ん……？）","(No-one's here...
...Hm?)"
0000000000000,プロデューサー,……お、差し入れだ……！,Oh! A bowl of soup!
0000000000000,プロデューサー,"（灯りのない中ここまで上ってきてくれたけど、
怖くなった──とか？）","(Perhaps they brought it up here,
but the lights were off so they got scared?)"
0000000000000,プロデューサー,ありがたいなぁ……,That was nice of them...
0000000000000,プロデューサー,"（後でお礼を言わないと……
──……うん、美味い……）","(I must thank them later...
Yum! This is good...)"
4001007050610,灯織,今の……悲鳴──！,That scream just now!
4001007050620,真乃,みんな……大丈夫かな……！,I wonder if they're okay!
4001007050630,めぐる,うーん……！,Yeah...!
4001007050640,めぐる,"さっき、もうすぐ着くよってメッセージ送ったんだけど、
まだ返事がなくて……！","I messaged them saying we'd be there soon, but there's been no reply...!"
4001007050650,めぐる,──でもダメっ、これ以上は心配だよ！,This is bad! I'm getting really worried!
4001007050660,真乃,"うん……！
みんなで、確かめに行こう……！",Me too! We have to help them!
4001007050661,灯織＆めぐる,うん……！,Let's go!
4001007050662,摩美々＆霧子,！,Oh!
4001007050670,霧子,"摩美々ちゃん……
今……","Mamimi,
was that...?"
4001007050680,摩美々,インターホン、鳴ったねー,The interphone. It rang.
4001007050690,霧子,だ、誰が……,W-Who's there...?
4001007050700,摩美々,ヤバい人かもー,It might be a bad person!
4001007050710,恋鐘,結華、扇風機のコードって使えそうじゃなか！？,"Yuika, can't you use the fan's power cord?"
4001007050720,結華,"コードは使えそうだけど、本体もセットで
動かさなきゃいけないからさすがにしんどい！","I could,
but I can't move the fan around very easily!"
4001007050730,恋鐘,"そっ、それもそうばい……！
探し直さんば……！","I see...
Let's look for something else..."
4001007050740,咲耶,"うーん、どこかで延長コードを見かけたような気は
するんだけど……","I'm sure I saw
an extension cable somewhere..."
4001007050750,霧子,"……み、みんな……
それどころじゃ……ないよね…………","H-Hey...
you're not thinking of... you know...?"
4001007050760,霧子,……！,......!
4001007050770,霧子,"……ま、摩美々ちゃん
大人の人がいるって……思わせなきゃ……！","M-Mamimi...
We have to make him think there's a grown-up in here!"
4001007050771,？？？,残念だったな……,That is most unfortunate...
4001007050780,灯織,──きゃあっ！,Ah!
4001007050790,めぐる,ど、どうしたの灯織……,"W-What is it, Hiori?"
4001007050800,灯織,中に……誰かいる……！,There's someone inside!
4001007050810,真乃,え……,Eh!?
4001007050820,灯織,今入ったら危ない──,It's too dangerous to go in at the moment.
4001007050830,灯織,"真乃もめぐるも、ここにいちゃダメ……！
早く、一旦戻って──！","Mano, Meguru, you can't stay here.
Quickly! Let's head back for now!"
4001007050840,めぐる,"え！？
で、でも、他のみんなが──","Huh!?
B-But what about everyone inside?"
4001007050850,灯織,"まずはふたりが逃げるのが先……！
早く……！","Firstly you two
need to get away from here! Hurry!"
4001007050860,真乃,──！,──!
4001007050870,真乃,めぐるちゃん、中のみんなには外から連絡を取ろう,"Meguru, we can try contacting those inside when we're safely outside."
4001007050880,真乃,今は──,But now's not the time!
4001007050890,めぐる,う、うん……！,R-Right!
info,game_event_communications/400100705.json,
译者,,
