ja,en
ファン人数を多く獲得できるオーディションは\nその分、合格するのが難しくなるので注意しましょう,ファン人数を多く獲得できるオーディションは\nその分、合格するのが難しくなるので注意しましょう
それでは最初のオーディションに戻ります,それでは最初のオーディションに戻ります
育てているアイドルの「得意ジャンル」と\n「流行１位のジャンル」が同じ時に挑戦することが\nオーディション成功のコツですよ～,育てているアイドルの「得意ジャンル」と\n「流行１位のジャンル」が同じ時に挑戦することが\nオーディション成功のコツですよ～
次に振り返りについて説明します,次に振り返りについて説明します
『W.I.N.G.』でのプロデュース、お疲れ様でした♪\nそれでは、フェスアイドルを誕生させましょう～,『W.I.N.G.』でのプロデュース、お疲れ様でした♪\nそれでは、フェスアイドルを誕生させましょう～
フェスアイドルの説明です,フェスアイドルの説明です
総合評価はフェスアイドルの能力によって評価されます\nプロデュース中のランクとは異なるのでご注意ください,総合評価はフェスアイドルの能力によって評価されます\nプロデュース中のランクとは異なるのでご注意ください
プロデュースの成績などによって\nよりよいものが獲得できるようになりますよ～♪,プロデュースの成績などによって\nよりよいものが獲得できるようになりますよ～♪
そしてフェスアイドル誕生の後\n条件を満たしていればTrueEndコミュが始まります,そしてフェスアイドル誕生の後\n条件を満たしていればTrueEndコミュが始まります
TrueEndコミュはご自身の力で\n確かめてみてくださいね～,TrueEndコミュはご自身の力で\n確かめてみてくださいね～
アイドルロードについて説明しますね〜,アイドルロードについて説明しますね〜
プロデュースについて簡単に説明しますね〜♪,プロデュースについて簡単に説明しますね〜♪
まずは「レッスン」について説明します〜,まずは「レッスン」について説明します〜
今明るく光っているのが「レッスン」です,今明るく光っているのが「レッスン」です
レッスンの種類は３つあります\nこちらではそれぞれ「Vocal」「Dance」「Visual」の\n基礎能力を伸ばすことができます,レッスンの種類は３つあります\nこちらではそれぞれ「Vocal」「Dance」「Visual」の\n基礎能力を伸ばすことができます
それでは……今回は\nボーカルレッスンに挑戦してみましょう～,"Well then... this time,
let's try a Vocal Lesson～"
プロデューサーさん、アイドルの体力が減っている事に\n気付きましたか？,"Producer, did you notice your idol's
stamina is decreasing?"
アイドルに無理をさせすぎると「トラブル」が発生して\nしまいます。こまめに休ませてあげましょうね\n体調管理もプロデューサーさんの大事なお仕事ですよ～,"""Trouble"" will occur if the idol works too hard.
Let's rest, managing your stamina is
also an important part of the job～"
それではオートの設定を進めていきましょう〜,それではオートの設定を進めていきましょう〜
まずは、プロデュース設定を行います,まずは、プロデュース設定を行います
『G.R.A.D.』を選択してみましょう,"Let's select ""G.R.A.D."""
「ユニット編成」について説明します,「ユニット編成」について説明します
ユニット編成はプロデュースを担当する\n「プロデュースアイドル」ひとりと,ユニット編成はプロデュースを担当する\n「プロデュースアイドル」ひとりと
彼女をサポートする\n「サポートアイドル」５人の計６人を編成します,彼女をサポートする\n「サポートアイドル」５人の計６人を編成します
プロデュースアイドルがどのような成長をするかは\n編成したサポートアイドルと\nスケジュールの組み方で左右されますよ～,プロデュースアイドルがどのような成長をするかは\n編成したサポートアイドルと\nスケジュールの組み方で左右されますよ～
サポートアイドルを編成しましょう\nサポートアイドルのアイコンをタップしてください♪,サポートアイドルを編成しましょう\nサポートアイドルのアイコンをタップしてください♪
例えばVocalが得意なプロデュースアイドルを\n育成したい場合には、「Vocal」に特化したスキルを\n多く持ったサポートアイドルを編成してみましょう～,例えばVocalが得意なプロデュースアイドルを\n育成したい場合には、「Vocal」に特化したスキルを\n多く持ったサポートアイドルを編成してみましょう～
所持スキルを確認したい時は、\nアイドルのアイコンを長押しして詳細を表示してください,所持スキルを確認したい時は、\nアイドルのアイコンを長押しして詳細を表示してください
編成するサポートアイドルをタップしてみましょう♪,Let's tap a Support Idol to set them♪
以上で編成のチュートリアルは終了です。\nアイドルの詳細を見ながらプロデュース方針に\n合ったサポートアイドルを編成してあげてくださいね～,"That ends this tutorial.
Please check the details of your
Support Idols to form a plan of action～"
余談ですが、「ほぼ全てのゲーム画面」に\n「？ボタン」が設置されていますよ\nわからないことがあったら、ここで確認をしてくださいね,余談ですが、「ほぼ全てのゲーム画面」に\n「？ボタン」が設置されていますよ\nわからないことがあったら、ここで確認をしてくださいね
もっとアイドルの育成方法について\n知りたい場合は初心者ミッションに挑戦してみてください,もっとアイドルの育成方法について\n知りたい場合は初心者ミッションに挑戦してみてください
初心者ミッションをクリアすると\n素敵な報酬も獲得できますよ〜♪,初心者ミッションをクリアすると\n素敵な報酬も獲得できますよ〜♪
初心者ミッションはプロデューサーデスクから\n挑戦することができます,初心者ミッションはプロデューサーデスクから\n挑戦することができます
さっそく初心者ミッションを\n体験してみましょう〜♪,さっそく初心者ミッションを\n体験してみましょう〜♪
「グレードフェス」に参加してみましょう〜,「グレードフェス」に参加してみましょう〜
３ターン目はこちらの「スキル」を\n選択してみてください,３ターン目はこちらの「スキル」を\n選択してみてください
アピールメーターをTAPしてください\nふふ、そろそろ慣れてきましたか～？,アピールメーターをTAPしてください\nふふ、そろそろ慣れてきましたか～？
新しく『オートプロデュース』が追加されました〜\n便利な機能なのでぜひ使ってみてくださいね〜,新しく『オートプロデュース』が追加されました〜\n便利な機能なのでぜひ使ってみてくださいね〜
ショップではゲームを進めていく上で\n役に立つ様々なアイテムを買うことができますよ〜,ショップではゲームを進めていく上で\n役に立つ様々なアイテムを買うことができますよ〜
商品はフェザージュエル、マニー、\nイベントポイントなどで買うことができます,商品はフェザージュエル、マニー、\nイベントポイントなどで買うことができます
アイテムと交換するものもありますから\n色々見てくださいね〜,アイテムと交換するものもありますから\n色々見てくださいね〜
それではゴールドトレーニングチケットを\n購入してみましょう～,それではゴールドトレーニングチケットを\n購入してみましょう～
プロデュースのチュートリアルお疲れ様でした。\n続いて大きなゲームの流れを説明していきます～♪,プロデュースのチュートリアルお疲れ様でした。\n続いて大きなゲームの流れを説明していきます～♪
ここプロデューサーデスクでは、アイドルを育成するための\nプロデュース業務を一覧できます,ここプロデューサーデスクでは、アイドルを育成するための\nプロデュース業務を一覧できます
様々なプロデュース業務をこなしてプロデューサーレベルを\n上げていくと、様々な特典を受けることができますよ〜♪,様々なプロデュース業務をこなしてプロデューサーレベルを\n上げていくと、様々な特典を受けることができますよ〜♪
まずは「初心者ミッション」を進めましょう\n基本的なプロデュース業務がわかるようになります,まずは「初心者ミッション」を進めましょう\n基本的なプロデュース業務がわかるようになります
その次は「『W.I.N.G.』攻略ミッション」にそって進めれ\nば、プロデュース『W.I.N.G.』編のコツがわかります,その次は「『W.I.N.G.』攻略ミッション」にそって進めれ\nば、プロデュース『W.I.N.G.』編のコツがわかります
進め方がわかったら『W.I.N.G.』編を繰り返して\n強いアイドルを育成しましょう〜,進め方がわかったら『W.I.N.G.』編を繰り返して\n強いアイドルを育成しましょう〜
『W.I.N.G.』編に慣れてきたら\nTrue End研修でさらなる攻略方法を学びましょう〜,『W.I.N.G.』編に慣れてきたら\nTrue End研修でさらなる攻略方法を学びましょう〜
そしてプロデュースは他にもあります\nファン感謝祭編は「アイデア」を集めることで\nアイドルを成長させるプロデュースです,そしてプロデュースは他にもあります\nファン感謝祭編は「アイデア」を集めることで\nアイドルを成長させるプロデュースです
『G.R.A.D.』編はサポートアイドルが持つ「ひらめき」に\nよってアイドルを成長させるプロデュースです,『G.R.A.D.』編はサポートアイドルが持つ「ひらめき」に\nよってアイドルを成長させるプロデュースです
『Landing Point』編は楽曲を選んで、それらの熟練度を\n上げることでアイドルを成長させるプロデュースです,『Landing Point』編は楽曲を選んで、それらの熟練度を\n上げることでアイドルを成長させるプロデュースです
『S.T.E.P.』編はアイドルが持つ「ノウハウ」を用いて\nアイドルを成長させるプロデュースです,『S.T.E.P.』編はアイドルが持つ「ノウハウ」を用いて\nアイドルを成長させるプロデュースです
そして育成したフェスアイドルでユニットを組んで\nグレードフェスに挑みましょう～,そして育成したフェスアイドルでユニットを組んで\nグレードフェスに挑みましょう～
ここではオートプロデュースの状況が一覧できます,ここではオートプロデュースの状況が一覧できます
『終了』はオートスケジュールの中断です\n未完了のプロデュースはキャンセルとなります,『終了』はオートスケジュールの中断です\n未完了のプロデュースはキャンセルとなります
『スキップ』は設定したオートスケジュールの\n残り時間をスキップし、進行中のプロデュースを完了します,『スキップ』は設定したオートスケジュールの\n残り時間をスキップし、進行中のプロデュースを完了します
スキップは1日5回までしか行うことができません\n残り回数を確認してくださいね〜,スキップは1日5回までしか行うことができません\n残り回数を確認してくださいね〜
「Dance担当審査員」を選択しましょう～,"Well then, let's select the Dance Judge～"
オートスケジュールが完了すると\nすべてのプロデュース結果がこちらに表示されます,"Once Auto-Produce is done,
you can check your producing results here."
誕生したフェスアイドルや獲得した報酬は\nこの画面で確認してくださいね〜♪,誕生したフェスアイドルや獲得した報酬は\nこの画面で確認してくださいね〜♪
今回はチュートリアルなので\nフェスアイドルや報酬はありません\n次はぜひプロデューサーさんご自身で使ってみてくださいね〜,今回はチュートリアルなので\nフェスアイドルや報酬はありません\n次はぜひプロデューサーさんご自身で使ってみてくださいね〜
以上でオートプロデュースのチュートリアルは終了です\nプロデューサーさん、お疲れ様でした〜,"That ends the Auto-Produce tutorial.
Producer-san, thanks for the hard work～"
今回のミッションではこちらのアイドルを選んでください,今回のミッションではこちらのアイドルを選んでください
オートプロデュースを開始するには、\n設定したオートプロデュース回数分のスタミナが必要です,オートプロデュースを開始するには、\n設定したオートプロデュース回数分のスタミナが必要です
必要スタミナに足りるように\nリカバリーソーダを使用してください,必要スタミナに足りるように\nリカバリーソーダを使用してください
オートを途中で終了した場合、実行中および準備中の\nリカバリーソーダは返却されます,オートを途中で終了した場合、実行中および準備中の\nリカバリーソーダは返却されます
最後に、このオート1の設定を繰り返す回数を設定します,最後に、このオート1の設定を繰り返す回数を設定します
1つの設定に対して『最大5回まで』設定することができます\n今回は『1回』で進めますね〜,1つの設定に対して『最大5回まで』設定することができます\n今回は『1回』で進めますね〜
これで基本的なオートの設定は完了しました〜,これで基本的なオートの設定は完了しました〜
次は『ループ』について説明します,次は『ループ』について説明します
チェックを入れるとプロデュース回数が25回になるまで\nオート1から順番に繰り返し実行する機能です,チェックを入れるとプロデュース回数が25回になるまで\nオート1から順番に繰り返し実行する機能です
今回はチェックを入れずに進めます,今回はチェックを入れずに進めます
それではスキルをひとつ習得してみましょう♪,それではスキルをひとつ習得してみましょう♪
『W.I.N.G.』で優勝するためには、\n準決勝、決勝で１位をとる必要があります,『W.I.N.G.』で優勝するためには、\n準決勝、決勝で１位をとる必要があります
優勝を目指すために\nスターの獲得方法を学びましょう,優勝を目指すために\nスターの獲得方法を学びましょう
今回は審査員が残り１人というところまで\n進めておきました,今回は審査員が残り１人というところまで\n進めておきました
決勝戦、最後の審査員に\n思いっきりアピールしましょう〜,決勝戦、最後の審査員に\n思いっきりアピールしましょう〜
「Visual担当審査員」を選択しましょう～,"Well then, let's select the Visual Judge～"
オートを開始した後の状況確認やスキップ、\n途中終了はここから行います,オートを開始した後の状況確認やスキップ、\n途中終了はここから行います
アイドルランクアップおめでとうございます\n各シーズン内にある「目標ランク」を必ず達成しましょうね,アイドルランクアップおめでとうございます\n各シーズン内にある「目標ランク」を必ず達成しましょうね
それでは……お待ちかねの\n「運命の出会いガシャ」にご案内しますね～,それでは……お待ちかねの\n「運命の出会いガシャ」にご案内しますね～
「運命の出会いガシャ」はプロデューサーさんの\n好きなタイミングで引くことができます,「運命の出会いガシャ」はプロデューサーさんの\n好きなタイミングで引くことができます
ただし、１回しか引くことができないので\nタイミングはよく考えましょうね～,ただし、１回しか引くことができないので\nタイミングはよく考えましょうね～
フェスアイドルを編成しました,フェスアイドルを編成しました
なお、フェスアイドルは必ず５人必要なので、\n全ポジションへの編成が必要になります,なお、フェスアイドルは必ず５人必要なので、\n全ポジションへの編成が必要になります
編成は色々試してみてくださいね～\n終わったら前の画面に戻りましょう～♪,編成は色々試してみてくださいね～\n終わったら前の画面に戻りましょう～♪
プロデュースユニットが所持している８つの\nライブスキルから３つがランダムに選出され、\n１ターンに１つを使うことができます,プロデュースユニットが所持している８つの\nライブスキルから３つがランダムに選出され、\n１ターンに１つを使うことができます
まずは、1つ目の「スキル」選択してみましょう～,まずは、1つ目の「スキル」選択してみましょう～
選択した「スキル」と同じジャンルの\n「担当審査員」に使うと『好印象』を得られますので\n覚えておいてくださいね～,選択した「スキル」と同じジャンルの\n「担当審査員」に使うと『好印象』を得られますので\n覚えておいてくださいね～
審査員の方を選択すると\n「アピールメーター」が表示されます\n基本は「Perfect」の位置を狙っていきましょう,審査員の方を選択すると\n「アピールメーター」が表示されます\n基本は「Perfect」の位置を狙っていきましょう
今が「Perfect」チャンスの位置です\n本番では、うまく狙ってくださいね,今が「Perfect」チャンスの位置です\n本番では、うまく狙ってくださいね
トレーニングしたいアイドルを選択します,トレーニングしたいアイドルを選択します
ここでSPを使って新しいスキルを習得できますよ～\n必要なSPはここを見てくださいね,ここでSPを使って新しいスキルを習得できますよ～\n必要なSPはここを見てくださいね
スキルを習得すると\n隣にあるスキルが選べるようになっていきます\n順番を考えながら習得していきましょう～,スキルを習得すると\n隣にあるスキルが選べるようになっていきます\n順番を考えながら習得していきましょう～
スキルの違いも見てみましょう～,スキルの違いも見てみましょう～
スキルを習得しました～\nこれで振り返りのチュートリアルはおしまいです♪,スキルを習得しました～\nこれで振り返りのチュートリアルはおしまいです♪
プロデューサーさん、やりましたね～\n審査員を満足させることができたので\n「スター」を獲得することができましたよ\n,プロデューサーさん、やりましたね～\n審査員を満足させることができたので\n「スター」を獲得することができましたよ\n
ライバルよりも「一番多くのスターを獲得」して\n１位を目指しましょう,ライバルよりも「一番多くのスターを獲得」して\n１位を目指しましょう
あ、アイドルが緊張してしまっているようですね\nプロデューサーさん、\n何か激励の言葉をかけてあげてください,あ、アイドルが緊張してしまっているようですね\nプロデューサーさん、\n何か激励の言葉をかけてあげてください
オーディションの直前はアイドルの\n緊張をほぐしてあげるのも、\nプロデューサーさんの大切な役目ですよ～,オーディションの直前はアイドルの\n緊張をほぐしてあげるのも、\nプロデューサーさんの大切な役目ですよ～
アイドルロードとは【白いツバサ】のアイドルたちが\n様々なミッションを経て成長してく場所となります,アイドルロードとは【白いツバサ】のアイドルたちが\n様々なミッションを経て成長してく場所となります
アイドルロードのミッションを確認してみましょう,アイドルロードのミッションを確認してみましょう
ここでミッションを確認することができますよ～,ここでミッションを確認することができますよ～
1つミッションを達成すると1歩先に進めることが出来ます,1つミッションを達成すると1歩先に進めることが出来ます
ぜひミッションを達成してゴールを目指しましょう♪,ぜひミッションを達成してゴールを目指しましょう♪
思い出ゲージが溜まりましたよ\nプロデューサーさんとアイドルとのコミュニケーション\nによって、引き出された能力です,思い出ゲージが溜まりましたよ\nプロデューサーさんとアイドルとのコミュニケーション\nによって、引き出された能力です
Goodのタイミングをうまく狙えると\n思い出アピールの力が「最大限」引き出されます,Goodのタイミングをうまく狙えると\n思い出アピールの力が「最大限」引き出されます
「Good」をTAPしましょう\n本番では、しっかり狙っていきましょう,「Good」をTAPしましょう\n本番では、しっかり狙っていきましょう
最後に補足です\n快適なプロデュースのために\nこちらを忘れずにやってくださいね〜,最後に補足です\n快適なプロデュースのために\nこちらを忘れずにやってくださいね〜
次に、ユニットを編成します\n今回はこのユニットをオートプロデュースしてみましょう〜,次に、ユニットを編成します\n今回はこのユニットをオートプロデュースしてみましょう〜
まれに、朝、アイドルから話しかけられることがありますよ,"Sometimes, the idols may talk to you in the morning."
アイドルの心情を汲み取って\n適切な返答を「素早く答える」必要がありますので\n日頃からアイドルのことをよく見ててあげましょう～,"You'll need to consider the idol's feelings and
give a ""Quick-Time response."" Let's be sure to
regularly pay attention to the idols～"
今回は私が適切な返答を教えてあげますね～,今回は私が適切な返答を教えてあげますね～
つぎは「お仕事」について説明しますね〜,つぎは「お仕事」について説明しますね〜
今明るく光っているのが「お仕事」です,今明るく光っているのが「お仕事」です
お仕事の種類も３つあるんですよ\nそれぞれ「メンタル」「SP」「ファン」を\n増やすことが可能なんです,"There are also 3 types of work.
It's possible to increase ""Mental"", ""SP"",
and ""Fans"" with these."
レッスン、お仕事にはそれぞれ\nサポートアイドルの皆さんがいます\n是非、一緒に行動して絆を深めていってくださいね～,"There are support idols in both lessons and
work. Please work together to
deepen your bonds～"
あ、プロデューサーさん、\n私がいることが気になりました？\nふふ。私はお手伝いをしているだけですよ\n,"Oh, Producer-san,
did you notice me?
Fufu. I'm just helping out."
こちらのアイドルとの絆を深めておきました\nさっそくラジオの収録に挑戦してみましょう～,こちらのアイドルとの絆を深めておきました\nさっそくラジオの収録に挑戦してみましょう～
フェスにもいろいろあるんですよ,フェスにもいろいろあるんですよ
ここはアイドルたちが競い合う\n「フェス」に参加するための場所になります,ここはアイドルたちが競い合う\n「フェス」に参加するための場所になります
