ja,en
今週にお休みをいただけませんか……？,Is it alright if I take time off this week...?
えへへ、チョコもたっぷり食べて\r\nばっちりリフレッシュしちゃいました,"Ehehe, I ate plenty of chocolate and now I'm totally
refreshed."
おかげ様で、元気100倍です！,"Thanks to you, I have a hundred times more energy!"
ああっ……！　私のチョコ……ケーキ……スイーツ……\r\n食べられるはずだったお菓子たち……！,"Ah...! My chocolates... cake... sweets... the candy
I should've been able to eat...!"
プロデューサーさん、お願いです……！\r\n今度は必ず時間、取っておいてください……！,"Producer-san, please...!
Please make sure to give me time next time...!"
一週間後にボーカルレッスンを\r\nやらせてください！,Please let me do a vocal lesson next week!
一週間後にレッスンさせてください！,Please let me do a dance lesson next week!
ビジュアルレッスン、\r\n一週間後にやらせてもらってもいいですかっ？,Is it okay if you let me do a visual lesson next week?
一週間後にお休みをいただけませんか……？,Is it alright if I take time off next week...?
二週間後にボーカルレッスンを\r\nやらせてください！,Please let me do a vocal lesson in two weeks!
二週間後にレッスンさせてください！,Please let me do a dance lesson in two weeks!
ビジュアルレッスン、\r\n二週間後にやらせてもらってもいいですかっ？,Is it okay if you let me do a visual lesson in two weeks?
二週間後にお休みをいただけませんか……？,Is it alright if I take time off in two weeks...?
なあ、プロデュ－サ－\r\nこの間の新曲、まだうまく歌えね－んだよ,"Hey, Producer.
I'm having trouble with the new song."
今週にボ－カルレッスンしてもいいだろ？,Can I have a vocal lesson this week?
本当かっ！\r\n約束、絶対だかんな！,"Really!?
Then it's a promise!"
ちぇ、仕方ね－な……\r\n……わかったよ,"Tch, ok then...
I understand."
流石に喉カラッカラだぜ\r\nでも、お陰でいい感じに歌えるようになった,"I really sang myself hoarse this time.
But thanks to that, I think I can nail the song now."
ありがとな、プロデュ－サ－,"Thanks, Producer."
なぁ、アンタ\r\nアタシとの約束忘れてね－か？,"Hey, you forgot about our promise, didn't you?"
ボ－カルレッスン、次は頼むぜ,Please remember the vocal lesson next time.
あんま集中できなかった……,I couldn't focus at all...
すまね－な\r\n折角予定組んでくれたのに……,"Sorry...
I made you go through all that trouble too..."
アタシのソロパ－トで、\r\nもう少し確認して－動きがあるんだよな……,There's a move in my solo part that I want to review...
今週にダンスレッスン頼めね－か？,Can I ask for a dance lesson this week?
納得いくまでレッスン出来たおかげで、\r\nダンスにキレが出てきた気がするぜ,"I got to practice until I was happy with it so I think
I've finished honing my moves for that dance."
予定組んでくれてありがとな、プロデュ－サ－,"Thanks for scheduling, Producer."
ダンスレッスンの予定、\r\n組んでくれるんじゃなかったのかよ？,Weren't you supposed to schedule a dance lesson?
ったく、今度は頼むぜ,"Ugh, please remember next time."
アイドルらしい化粧の仕方ってのが、\r\nどうも苦手でな……,I'm not good at doing idol-like makeup at all...
今週にビジュアルレッスン頼みて－んだけど……\r\nいいか？,"I want to ask for a visual lesson this week...
Is that okay?"
アイドルらしい化粧ってのは、やっぱ難しいな……\r\nけど、コツは掴んだぜ！,"Doing idol-like makeup is so difficult...
But I'm getting the knack of it!"
サンキュ－な、プロデュ－サ－,"Thank you, Producer."
ビジュアルレッスンの約束はどうした？,What happened to the promise for a visual lesson?
いいのかよ？\r\nこのままじゃ、いつまでたっても上達できね－ぞ,"You're fine with this?
I'm never improving at this rate."
今週に好きなチ－ムの試合があるんだけどよ……,My favorite team has a game this week...
そん時だけ、休み貰えね－か？,"Can I take some time off, just this once?"
いや－、久々にテンション上がったぜ！\r\n最高にアツい試合だった！,"Wow, I haven't felt this fired up in a long time!
What an incredible match!"
アンタのお陰でいい休日になったよ\r\nサンキューな、プロデューサー,"I had a great day off thanks to your help.
Thank you, Producer."
今日の試合、楽しみにしてたんだけどな……,I was really looking forward to the game today...
ま、仕方ね－よな……,"Oh well, whatever, I guess..."
一週間後にボ－カルレッスンしてもいいだろ？,Can I have a vocal lesson next week?
一週間後にダンスレッスン頼めね－か？,Can I ask for a dance lesson next week?
一週間後にビジュアルレッスン頼みて－んだけど……\r\nいいか？,"I want to ask for a visual lesson next week...
Is that cool?"
一週間後に好きなチ－ムの試合があるんだけどよ……,My favorite team has a game next week...
二週間後にボ－カルレッスンしてもいいだろ？,Can I have a vocal lesson two weeks from now?
二週間後にダンスレッスン頼めね－か？,Can I ask for a dance lesson two weeks from now?
二週間後にビジュアルレッスン頼みて－んだけど……\r\nいいか？,"I want to ask for a visual lesson two weeks from
now... is that okay?"
二週間後に好きなチ－ムの試合があるんだけどよ……,My favorite team has a game two weeks from now...
プロデューサーさま……,Producer-sama......
高音が……安定しないのです\r\n今週、レッスンを、お願い、したいのですが……,"My pitch is off...
May I... have a lesson this week...?"
凛世を、お気遣いくださり……\r\nありがとう、ございます。プロデューサーさま……,"Thank you... for being considerate... towards Rinze...
Producer-sama..."
……お手を、煩わせてしまい\r\n申し訳、ございませんでした,"...I must have... bothered you.
I apologize..."
効果が出たように……思われます,I believe... it seems to have worked...
少々……自信が、つきました\r\nプロデューサーさま、ありがとう、ございます,"I have gained... some confidence...
Producer-sama, thank you... very much..."
何か、お考えが、あったのですね……,I see you had... a different idea...
プロデューサーさまは、お忙しい身\r\nこの凛世、わがままは、申しません,"Producer-sama must be busy.
I apologize... for my selfishness..."
成果のほどは……\r\nあまり芳しくは、ございませんでした,"The outcome...
Turned out... to not be favorable."
至らぬ凛世を、お許しください……,Please excuse... Rinze's inadequacy...
プロデューサーさま\r\n凛世の舞は……いかがでしょう……,"Producer-sama, my dancing... what do you think...?"
お気に召すよう、舞いたいのです……\r\n今週、レッスンを、いたしたく思います,"I hope you liked it...
Would it be fine, if I took a dance lesson this week...?"
要領が、つかめて参りました……,I think I am getting used to it...
舞うのが……楽しいのです,Dancing... It is quite fun...
本日は、舞のレッスンが……,"Today, I had a dance lesson..."
いえ……\r\n何でも……ないのです,"No...
It is... nothing..."
装いには、心の姿が……現れます……,"In one's adornment, the condition of the heart...
is embodied..."
プロデューサーさま、お化粧のレッスンを\r\n今週にしておきたいのですが……,"Producer-sama, this week... could I have a visual
lesson..."
よきご指導を……頂くことが、できました\r\nありがとう、ございます……,"To have accepted... your guidance...
Thank you, very much..."
この姿……貴方さまには、\r\n見目よく、映っておりましょうか,"This appearance... to you, is it a good one...?"
お化粧の、レッスン日……,A visual lesson day...
きっと、お忙しかったのですね……\r\nプロデューサーさまの、お身体が……心配です,"I am certain you were busy...
Producer-sama, I worry... for your health..."
少しばかり、無理を、いたしました……,Perhaps it was a bit... unreasonable...
今週に、お休みを頂戴できますでしょうか……,This week... Could I ask... to take a break...?
疲れを癒すことが、できました\r\nありがとう、ございます……,"I was able... to heal my fatigue...
Thank you very much..."
凛世はもう、大事ございません,Rinze is... no longer important...
……！\r\n申し訳ございません……少々、疲労が……,"...!
I humbly apologize... I am a bit exhausted..."
これも、試練、なのですね……,"This too, is perhaps a test..."
高音が……安定しないのです\r\n一週間後、レッスンを、お願い、したいのですが……,"My high notes... are unstable...
In one week, may I... have a vocal lesson...?"
お気に召すよう、舞いたいのです……\r\n一週間後、レッスンを、いたしたく思います,"I would like to dance... in the way you prefer...
Do you think... I could have a dance lesson... in one
week?"
プロデューサーさま、お化粧のレッスンを\r\n一週間後にしておきたいのですが……,"Producer-sama, next week...
Could I have a visual lesson..."
一週間後に、お休みを頂戴できますでしょうか……,Could I possibly... rest in one week...?
高音が……安定しないのです\r\n二週間後、レッスンを、お願い、したいのですが……,"My high notes... are unstable...
In two weeks, may I... have a vocal lesson...?"
お気に召すよう、舞いたいのです……\r\n二週間後、レッスンを、いたしたく思います,"I would like to dance... in the way you prefer...
Do you think... I could have a lesson... in two weeks?"
プロデューサーさま、お化粧のレッスンを\r\n二週間後にしておきたいのですが……,"Producer-sama, in two weeks...
Could I have a visual lesson..."
二週間後に、お休みを頂戴できますでしょうか……,Would you kindly... allow me to rest in two weeks...?
プロデューサー、\r\nもっと歌の技術を磨きたいわ,"Producer, I'd like to polish my singing technique
further."
今週はボーカルレッスンをしましょう！,Let's have a vocal lesson this week!
それでこそよ、プロデューサー！,"Attaboy, Producer!"
そう……仕方がないわね,I see... I guess it can't be helped.
ふぅ……けっこう歌えたわね,Phew... I sang quite a lot.
発声がよくなった感じがするわ\r\n約束、守ってくれて嬉しいわ,"It feels like my vocalization's improved.
I'm happy you kept your promise."
やっぱり歌の技術が磨きたかったわね……,I really wanted to polish up my singing technique...
いい？　今度はちゃんと約束を守るのよ？,"Listen. You better make sure to keep your promise
next time, okay?"
思うような成果は出なかったわ……,Things didn't go the way I expected...
でも、これを次につなげていくわ！,But I'll be sure to get it right next time!
トップを目指すには、ダンスの実力がまだまだだわ……,"If I want to aim for the top, I'll need to have better
dancing skills..."
ダンスレッスンをしたいから、\r\n今週付き合って頂戴、プロデューサー！,"I want to have a dance lesson this week, so I'll need
you to come along with me, Producer!"
ふぅ、いい汗をかいたわね,"Phew, I worked up a good sweat."
ダンスのキレが良くなった気がするの\r\nありがとう、プロデューサー,"I noticed my steps have gotten much sharper.
Thank you, Producer."
ダンスで確認したいところがあったのだけど……,"There were parts in the dances that I really
wanted to go over."
次は約束を忘れないで頂戴,Please don't forget your promise next time.
アイドルとして\r\n自分をより美しく見せることも大事だと思うの,"Showing off your good points is one of the most
important parts of being an idol, in my opinion."
今週はビジュアルレッスンを\r\nしたいのだけど、いいかしら？,"I wanted to have a visual lesson this week.
Is that alright with you?"
ねぇ、プロデューサー。私をよく見て頂戴,"Hey, Producer. Take a good look."
また一段と美しくなれたでしょう？\r\nこれもプロデューサーのお陰よ,"Don't I look even prettier now?
It's thanks to you, of course."
もう！　次の仕事に備えてポーズとか研究したかったのに！,"Honestly! Even though I wanted to research a pose
for my next job!"
次は必ず約束を守りなさい！,You better keep your promise next time!
適度な休息も、トレーニングのうちだと思うわ,"It's important to rest in moderation when doing
a lot of training."
今週はお休みをもらってもいいかしら？,Would it be alright if I took this week off?
ゆっくり休んで、リフレッシュできたわ,I feel refreshed now that I took it easy this week.
また頑張るわよ！,Now it's back to work!
ここで身体を休めるはずだったのに……,I was supposed to give my body a break this week...
約束を守ってもらわないと、予定も組めないわ\r\n今度からはちゃんと守るのよ？,"If you don't keep your promises, I can't make proper
plans. Make sure you keep your promise next time,
okay?"
一週間後はボーカルレッスンをしましょう！,Let's have a vocal lesson a week from now!
ダンスレッスンをしたいから、\r\n一週間後付き合って頂戴、プロデューサー！,"I want to have a dance lesson next week, so I'll need
you to come along with me, Producer!"
一週間後はビジュアルレッスンを\r\nしたいのだけど、いいかしら？,"I wanted to have a visual lesson next week.
Is that alright with you?"
一週間後はお休みをもらってもいいかしら？,Would it be alright if I took next week off?
二週間後はボーカルレッスンをしましょう！,Let's have a vocal lesson two weeks from now!
ダンスレッスンをしたいから、\r\n二週間後付き合って頂戴、プロデューサー！,"I want to have a dance lesson two weeks from now,
so I'll need you to come along with me, Producer!"
二週間後はビジュアルレッスンを\r\nしたいのだけど、いいかしら？,"I wanted to have a visual lesson two weeks from
now. Is that alright with you?"
二週間後はお休みをもらってもいいかしら？,Would it be alright if I took the week after next off?
甘奈ね、自分の歌い方で\r\n少し気になってるところがあるんだよね,"I'm uh, a little bit concerned about the way that I sing."
今週にボーカルレッスン、頼んでいいかな,"Would it be alright to ask for a vocal lesson this
week?"
さっすがプロデューサーさん！\r\n話が分かるー☆,That's my Producer-san! You totally get it☆
そっかー。それじゃしょうがないよねー…\r\n無理言っちゃって、ごめんね！,"Gotcha── Can't be helped then...
Sorry for asking something unreasonable!"
今日のレッスンで\r\nどうやって歌ったらいいかよくわかったよ,"I was able to figure out a good way to sing in
today's lesson."
ありがとねっ、プロデューサーさん,"Hey thanks, Producer-san."
やっぱり自主レッスンだと、\r\n気になるところは解決できないなぁ,"As I figured, I wasn't able to fix it through
independent study."
次はしっかり約束守ってね\r\nプロデューサーさん,"Make sure to keep your promise next time,
Producer-san."
ごめんね、プロデューサーさん\r\n無理を聞いてくれたのに……,"Sorry, Producer-san. It was an impossible request..."
次は応えられるようにがんばるからね！,I'll do my best to meet your expectations next time!
プロデューサーさん\r\nどうしてもできないステップがあってね,"Producer-san, I can't figure out this step no matter
what I do."
今週にダンスレッスンお願いできる？,Could I request a dance lesson this week?
バッチリ、キレのあるステップが\r\nできるようになったんだ☆,"Right on, I was totally able to do that step☆"
甘奈、ダンスちょっと上手になったかも\r\nプロデューサーさん、ありがと,"I might be a little bit better at dancing now.
Producer-san, thanks."
自分で練習もしてみたけど……\r\n鏡とか見てもっとチェックしたかったなー,"I practice by myself but...
I wanted to check in the mirror more──"
次は予定、\r\nしっかり覚えててくれると嬉しいな,"Next time, I'd be happy if you remembered well."
甘奈、この前雑誌読んでて、ちょーかわいー\r\nメイク思いついちゃったんだ！,"I was reading a magazine earlier and came up with
a cute makeup idea!"
試してみたいから\r\n今週にビジュアルレッスンお願いしたいな,"Since I wanted to try it, could I ask for a visual
lesson this week?"
思いついたメイクを試してみたらね\r\nスゴくいい感じだったんだよね！,"I tried the makeup I just came up with.
It turned out amazing!"
今度プロデューサーさんにも見てもらいたいな\r\n約束守ってくれて、ありがとねっ,"I want you to see it next time.
Thanks for keeping your promise."
うーん、あのメイク\r\nどうやったらモノにできたのかな～,"Hmmm, how was I going to do that makeup again～"
ちょっと残念だったかな～,That's kind of a bummer～
プロデューサーさん！\r\nどーしても外せない用事が出来ちゃって……,"Producer-san! There's something I have to take care
of that I can't get out of."
今週ってお休みもらえたりするかな,Would it be okay for me to take a break this week?
お休みもらえたおかげで、\r\nしっかりと予定が守れたよー,"Thanks to the break, I was able to keep my
promises──"
お陰で甘奈、頑張れるっ！\r\nありがとー☆,"Because of you, I can do my best! Thanks☆"
お仕事だもん、仕方ないよね……,"Since it's work, it can't be helped..."
でも次はよろしくね\r\nプロデューサーさん,"But please help me out next time, Producer-san."
一週間後にボーカルレッスン、頼んでいいかな,"Would it be alright to ask for a vocal lesson
next week?"
一週間後にダンスレッスンお願いできる？,Could I request a dance lesson next week?
試してみたいから\r\n一週間後にビジュアルレッスンお願いしたいな,"Since I wanted to try it, could I ask for a visual
lesson next week?"
一週間後ってお休みもらえたりするかな,"Would it be okay for me to take a break next
week?"
二週間後にボーカルレッスン、頼んでいいかな,"Would it be alright to ask for a vocal lesson in
two weeks?"
二週間後にダンスレッスンお願いできる？,Could I request a dance lesson in two weeks?
試してみたいから\r\n二週間後にビジュアルレッスンお願いしたいな,"Since I wanted to try it, could I ask for a visual
lesson in two weeks?"
二週間後ってお休みもらえたりするかな,"Would it be okay for me to take a break in two
weeks?"
プロデューサーさん……\r\n甜花……もっと大きい声、出せるように……なりたい……,"Producer-san...
Tenka... wants to be able to sound... louder..."
だから、今週……歌のレッスン……したい……,"So, for this week... Let's do a vocal lesson... Please..."
にへへ……うれしい……,Nihehe... Tenka's happy...
わかった……がまん……するね……,Tenka... understands now...
歌うの……楽しいね……\r\n声も、大きくなった……気がする……,Singing... is fun... Tenka's voice... is louder now...
にへへ……プロデューサーさん、ありがとう……,Nihehe... Producer-san... Thank you...
プロデューサーさん……ボーカルレッスンは……？,Producer-san... What about the vocal lesson...?
甜花……のど飴……たくさんなめたのに……,Tenka... already ate... a lot of cough candy...
あ、あれ……？　こうじゃ、ない……？,H-Huh...? It is cancelled...?
あう……ぜんぜん……ダメだった……\r\n次はできるように、するね……,"Ah... So... it's impossible...
Let's do it next time, okay..."
甜花……もっといい動きが、できるようになれば……\r\nみんなにも……迷惑、かけない……,"If... Tenka moves better than before...
Tenka won't... trouble everyone..."
今週はダンスレッスンが……いいな……,It'll be great if... we can do dance lesson this week...
うん……甜花、ダンス……\r\nうまくなった……たぶん……,Um... Tenka's dancing... is getting better... maybe...
プロデューサーさんの、おかげ……ありがとう……,It's thanks to Producer-san... Thank you...
今日……ダンスレッスンじゃ……なかったっけ……,Isn't today... time for dance lesson... right...
甜花……踊る準備、してたんだけど……\r\n次はちゃんと……入れておいてね……,"Tenka... already prepared herself to dance...
Next time... Don't forget, okay..."
塗る？　付ける？　プロデューサーさん……\r\nメイクって、どうやるんだろう……,"Gloss? Put on? Producer-san...
How do you properly do makeup..."
知らないと……ダメだよね……\r\n今週に……ビジュアルレッスン……させて……,"It'll be bad... if you don't know, right...
This week... Visual lesson... Please..."
これは……付けるものなんだ……\r\nこれで……甜花も、なーちゃんみたいに……,"So this is... something to put on...
With this... Tenka's a bit more like Naa-chan..."
プロデューサーさん……約束守ってくれて……\r\nありがとう……,"Producer-san... Thank you for keeping...
your promise..."
ビジュアルレッスン……無くなっちゃったんだ……,Visual lesson... is cancelled...
メイクができなくて……また迷惑かけちゃう……\r\nプロデューサーさん……次はきっと、ね……,"If Tenka can't do makeup... she'll trouble everyone
again... Producer-san... next time, okay..."
プロデューサーさん……えっと……\r\n甜花……お昼寝をいっぱいしたくて……,"Producer-san... Umm...
Tenka... wants to take more naps..."
お休みが欲しいんだけど……\r\n今週って……ダメかな……？,"Tenka wants to take a rest... for this week...
is that okay...?"
お休みで……いっぱい、お昼寝した……\r\n充電、完了……！,"After resting... with a lot of naps...
Energy recharge, is complete...!"
甜花……また頑張る、ね……,"Tenka... will do her best again, okay..."
え……お休み、ないんだ……\r\nお昼寝の道具……準備してたのに……,"Eh... There's no rest time...
Even though... the napping preparations are
complete..."
お休み……忘れないでほしい、です……,"Please... don't forget about Tenka's rest, next time..."
だから、一週間後……歌のレッスン……したい……,"So, for next week... Let's do a vocal lesson... Please..."
一週間後はダンスレッスンが……いいな……,It'll be great if... we can do dance lesson next week...
知らないと……ダメだよね……\r\n一週間後に……ビジュアルレッスン……させて……,"It'll be bad... if you don't know, right...
Next week... Visual lesson... Please..."
お休みが欲しいんだけど……\r\n一週間後って……ダメかな……？,"Tenka wants to take a rest...
For next week... is it okay...?"
だから、二週間後……歌のレッスン……したい……,"So, two weeks from now...
Let's do a vocal lesson... Please..."
二週間後はダンスレッスンが……いいな……,"It'll be great if... we could do a dance lesson two
weeks from now..."
知らないと……ダメだよね……\r\n二週間後に……ビジュアルレッスン……させて……,"It'll be bad... if you don't know, right...
Two weeks from now... Visual lesson... Please..."
お休みが欲しいんだけど……\r\n二週間後って……ダメかな……？,"Tenka wants to take a rest...
Two weeks from now...is that okay...?"
あーあーあーあーあー♪\r\n声……出てます？,"Ah-ah-ah-ah-ah～♪
Do I... have the right pitch?"
私、もうちょっと練習したくて……\r\n今週にボーカルレッスンを入れていただけませんか？,"I would like to practice a bit more...
Could you schedule a vocal lesson for this week?"
わぁ、ありがとうございます♪\r\nプロデューサーさん,"Yay, thank you very much, Producer-san♪"
まあ、そうなんですね……、いえ\r\n私が急に言い出したことですから、お気になさらず,"Oh, is that so... No, don't worry about it.
It was a sudden request after all."
