ja,en
白か～で美しか雪の降る夜……\n空ば見たら、\n吸い込まれそうな気になるけん,白か～で美しか雪の降る夜……\n空ば見たら、\n吸い込まれそうな気になるけん
いつか骨になったら\nうちの身体ば飾ってね\n永遠に一緒に居られるばい,いつか骨になったら\nうちの身体ば飾ってね\n永遠に一緒に居られるばい
プレゼントの中身、\nいろんなもんば用意しとると\n渡せんまんまやけどね,プレゼントの中身、\nいろんなもんば用意しとると\n渡せんまんまやけどね
ふふ～……\nもうなんもしゃべれんね？\nよかよか、その分話しちゃる,ふふ～……\nもうなんもしゃべれんね？\nよかよか、その分話しちゃる
行かんば、約束の場所──,行かんば、約束の場所──
いてもたってもいられなくって\n走り出す感じ、\nうち、ばり好きなんよ～,いてもたってもいられなくって\n走り出す感じ、\nうち、ばり好きなんよ～
応援するとも、応援されるとも、\n嬉しか気分になるもんやけん～！,応援するとも、応援されるとも、\n嬉しか気分になるもんやけん～！
歌って踊って、\n気持ちの届いたとき……\nば～り幸せな気持ちになるばい！,歌って踊って、\n気持ちの届いたとき……\nば～り幸せな気持ちになるばい！
うちと一緒に、\nず～～っとどこまでも\n走っていくばい～！,うちと一緒に、\nず～～っとどこまでも\n走っていくばい～！
ここまであっという間やった……,ここまであっという間やった……
んふふ～\nうちも随分とおっきくなったと,んふふ～\nうちも随分とおっきくなったと
いつかまたあん故郷の海で──,いつかまたあん故郷の海で──
身長だけ伸びんかったとは\n残念ばい,身長だけ伸びんかったとは\n残念ばい
うちが宇宙一のばりすごか\nアイドルになるとば傍で見とってね！,うちが宇宙一のばりすごか\nアイドルになるとば傍で見とってね！
白くてやわらかかやつとか～\n茶色のサクサクのやつとか～\nん～、なんか忘れとらん～？,白くてやわらかかやつとか～\n茶色のサクサクのやつとか～\nん～、なんか忘れとらん～？
う、うちも……！\nこの間、渡せんかったけん\n交換したか……！,う、うちも……！\nこの間、渡せんかったけん\n交換したか……！
ぷ、プロデューサー……\nバレンタインにうちが言うた\nこと、覚えとる……？,ぷ、プロデューサー……\nバレンタインにうちが言うた\nこと、覚えとる……？
一年にいっぺんしか会えんなんて、うちならぜーったいに\n耐えられんばい……！,一年にいっぺんしか会えんなんて、うちならぜーったいに\n耐えられんばい……！
うさぎがお月さんで\nついた餅……\nうまかやろうね～,うさぎがお月さんで\nついた餅……\nうまかやろうね～
お菓子いっぱい作ったけん\nあのセリフ、\n何回言ってもよかよ～！,"""I made lotsa snacks, y'all!""
...Sayin' that never gets old～!"
あ、プロデューサー\nじゃないですかぁ\nどーしたんですかぁ？,"Oh, if it isn't Producer.
What do you want?"
ふわぁ～\nおはよーございまぁす\nまだ眠いですよー,"Fwaaah～
Good morning.
I'm still so sleepy."
私、悪い子ですからぁ、\nイタズラは好きですよー,"I'm a bad girl, so...
I love playing pranks."
私、頑張ったと思いませんかぁ？\n……ってことで\nご褒美のお寿司、待ってまぁす,"Don't you think I've been working hard? ...So then, I'll be awaiting reward sushi～"
勝手に触らないでくださいー\nいきなりなんですかぁ,"Don't just touch me as you pleaseー
Where did that come from?"
……もしかしてー\nプロデューサーも頭撫でて欲しいんですかぁ？　ふふー,"...Perhaps, you want to be patted too? Fufu."
…………\n……不愉快なんですケド,"...
... This feels wrong."
最低な変態さんにはぁ、仕返しが必要ですよねー\nふふー遠慮せずにいきますよー,"Disgusting perverts need to be
punished, don't they～ Fufu～
I won't be holding back～"
……何するんですかぁ\nプロデューサーのせいで服が汚れたかもしれませんー,"... What are you doing?
You might get my clothes dirty～"
……ふふー……プロデューサー\nイタズラにはイタズラで返しますねー,"...Fufu～... Producer,
if you're misbehaving I'll
misbehave right back～"
"オーガンジーのリボン、霧子の髪に似合うと思うんですよねー
何って誕生日プレゼントですよ","オーガンジーのリボン、霧子の髪に似合うと思うんですよねー
何って誕生日プレゼントですよ"
ふふー。私を待たせるなんてー\n覚悟しておいてくださいねー,"Fufu～ Can't believe you kept me waiting～
You better be prepared for that～"
遅かったですねー\n待ちくたびれちゃいましたぁ,"Took your time getting here, didn't you?
I got bored waiting for you."
退屈な運命なんて興味ない\n……言ってる意味、\nわかりますよねー？,"I have no interest in living a boring life.
...You know what I mean by that,
don't you～?"
ふふー\nタバスコ入りカレードリアの\n味はどうでしたぁ？,"Fufu～
That tabasco curry doria,
how did it taste?"
孤独を吹き飛ばす炎──\n聴こえますか？,"Loneliness is blown away
by the flames of passion.
Can you hear it?"
まみみは、まみみですからねー,"Mamimi is Mamimi, ya knowー"
びっくりしましたかぁ？\nふふー……今、びっくり\nしてましたよねー？,"Did I surprise you?
Fufu～... Just now,
I surprised you, didn't I?"
私たちが旅に出る理由……\nそれを知る旅の始まりですー,"A reason to go on a trip...
When you have it,
the trip's started!"
『物事の価値は斜めから\n測るべし』\nby 田中摩美々,『物事の価値は斜めから\n測るべし』\nby 田中摩美々
ウォント・ミー\n──捕まえられたらの\n話ですケド,ウォント・ミー\n──捕まえられたらの\n話ですケド
私の熱さ、伝わりますかぁ？,私の熱さ、伝わりますかぁ？
今日もまぁ、\nほどほどにやってきまぁす,今日もまぁ、\nほどほどにやってきまぁす
アンティーカの物語を\n見せてあげましょうかねー,アンティーカの物語を\n見せてあげましょうかねー
私は、誰にも捕まらない\n複雑なパープル──,私は、誰にも捕まらない\n複雑なパープル──
ミライを進んでいく\nひとつのウタを道標にして──,ミライを進んでいく\nひとつのウタを道標にして──
私を待たせて\n何してたんですかねー,私を待たせて\n何してたんですかねー
……待ってたんですケド\nプロデューサーのこと,……待ってたんですケド\nプロデューサーのこと
鎖で繋いだら、ほら\nもう逃げられませんねー,鎖で繋いだら、ほら\nもう逃げられませんねー
そこのコンビニまで\n肉まん買いに来ただけですよー,そこのコンビニまで\n肉まん買いに来ただけですよー
片翼でも\n飛び回れますからぁ,片翼でも\n飛び回れますからぁ
嘘や、偽りのない──,嘘や、偽りのない──
……ふふ\nこういう時間も、\nいいかもですねー,……ふふ\nこういう時間も、\nいいかもですねー
抗って、彷徨って\nそれでも私たちは──,抗って、彷徨って\nそれでも私たちは──
『乙女の真心』ですよー\n……ちょっとー、なんか\n言ってくれませんー？,『乙女の真心』ですよー\n……ちょっとー、なんか\n言ってくれませんー？
飛び込め──\n燃える青の烈しさへと,飛び込め──\n燃える青の烈しさへと
ぶち壊せ、って──,ぶち壊せ、って──
シャボン玉、\n可愛いなって思って\n買ってあったんですよー,シャボン玉、\n可愛いなって思って\n買ってあったんですよー
眠りを妨げる　声が聞こえる\n──本当なのか　嘘なのか,眠りを妨げる　声が聞こえる\n──本当なのか　嘘なのか
ふふー\nシャボン玉、ぶつかって\nはじけて──綺麗ですよー？,ふふー\nシャボン玉、ぶつかって\nはじけて──綺麗ですよー？
眠れない　眠りたくない\n……もう一度\nその声を聞けるまで,眠れない　眠りたくない\n……もう一度\nその声を聞けるまで
いい子にも、悪い子にも……,いい子にも、悪い子にも……
悪い子にも、\nクリスマスって\nあるみたいですー,悪い子にも、\nクリスマスって\nあるみたいですー
さぁ──\n潔く、覚悟を決めて,さぁ──\n潔く、覚悟を決めて
ふふー、悪い子は\nいませんかぁ？　……これ、\nクリスマス関係ないですねー,ふふー、悪い子は\nいませんかぁ？　……これ、\nクリスマス関係ないですねー
未来への一閃──\nここに居る全員が\nその目撃者ですよー,未来への一閃──\nここに居る全員が\nその目撃者ですよー
イージー、ですねー,イージー、ですねー
私にだって、朝ごはん作るくらいできますケドー,私にだって、朝ごはん作るくらいできますケドー
いつもと違う遊び──\nしてみませんかぁ？,いつもと違う遊び──\nしてみませんかぁ？
あれー？\nわかりやすい方がいいって\n言ってませんでしたっけー？,あれー？\nわかりやすい方がいいって\n言ってませんでしたっけー？
秘密のティーパーティー？\nエスコート、\nしてくれるんですよねー？,秘密のティーパーティー？\nエスコート、\nしてくれるんですよねー？
紫に、染まりますかぁ？,紫に、染まりますかぁ？
これが私──\nかもですねー,これが私──\nかもですねー
複雑で綺麗──\nでしょ？,複雑で綺麗──\nでしょ？
もっと曖昧に\nもっと複雑に,もっと曖昧に\nもっと複雑に
私の姿\nちゃんと見えてる？,私の姿\nちゃんと見えてる？
まみみはいつもオフなんでー,まみみはいつもオフなんでー
ギャップとか\nないと思うんですケドー,ギャップとか\nないと思うんですケドー
悪い子には、\n角が生えるみたいですー,悪い子には、\n角が生えるみたいですー
まみみのオンって\nなんだったんですかねー,まみみのオンって\nなんだったんですかねー
黒魔術って\nイタズラに使えそうですよねー,黒魔術って\nイタズラに使えそうですよねー
どこに消えたでしょー,どこに消えたでしょー
念じてくださいー\nその場所に行きますんでー,念じてくださいー\nその場所に行きますんでー
私で遊んでもいいですよー\n使用料取りますケドー,私で遊んでもいいですよー\n使用料取りますケドー
ちゃんと念じましたかぁ？\nじゃー、手を開けてくださぁい,ちゃんと念じましたかぁ？\nじゃー、手を開けてくださぁい
ぜんまいは巻かないでくださいー\n動くのめんどーなんで,ぜんまいは巻かないでくださいー\n動くのめんどーなんで
私、なんだか甘い物が食べた\nい気分ですー。……忘れてる\nなら別にいいですケドー……,私、なんだか甘い物が食べた\nい気分ですー。……忘れてる\nなら別にいいですケドー……
急になんですかぁ？\n……でも、ふふー\nお菓子ゲットー,急になんですかぁ？\n……でも、ふふー\nお菓子ゲットー
──え\n……ぁ、……そ、そーいうん\nじゃなかったんですケド……,──え\n……ぁ、……そ、そーいうん\nじゃなかったんですケド……
短冊に書くのって、どんな願いごとでもいいんですかぁ？\nふふー、何から書こうかなぁ,短冊に書くのって、どんな願いごとでもいいんですかぁ？\nふふー、何から書こうかなぁ
ずっと黙ってたんですケドー\n私、満月の夜になると……\n…………嘘ですよー,ずっと黙ってたんですケドー\n私、満月の夜になると……\n…………嘘ですよー
今すぐストロベリーサンデーが食べたいですー。用意できないならイタズラしまぁす,"I want a strawberry sundae right now. If you can't get me one, I'll play a trick on you～"
やあ、私に何か用かな？,Hello. Is there something I can do for you?
これからも頼りに\nさせてもらうよ,"Please, continue to guide me. "
私をプロデュースするのは、\n楽しいかい？,"Do you find producing me enjoyable? "
"今回は、いつもと少し趣向を変えて
──褒めてほしい、なんてワガママは
聞いてもらえるだろうか……？","I'd like to try something different.
What if you gave me a compliment?
I hope that you will listen to my selfish request."
っと……\n……いや、頭に触れられるのは\nあまり慣れてなくてね,"Ah... er, I'm not really used to anyone touching my head."
私は小さな子どもでは\nないのだけれど……\n……いや……悪くはないよ,"I'm not a small child anymore... 
But... ah... This isn't so bad."
……他の子たちにも、\nこんなことをしては\nいないだろうね？,"...... You don't do this to the
others, do you?"
全く……\n私だけにしてくれないかな、\nこういうことは,"Seriously...
Could you not do these sort 
of things to me at all?"
……体に触れる前には、\n一言言って欲しいかな\n女性に対するマナーだよ,"... Before you touch me, I would 
like it if you said a few words.
It's good manners after all."
スタイルには気を\n遣ってるつもりだよ\nアナタから見て、どうだろうか,"I try to pay the utmost attention 
to my style, what do you think of it?"
"今日は私たちが包帯代わりさ
抱えきれないたくさんの愛で、霧子を包んであげたいんだ","Today we are the bandages and 
we want to wrap Kiriko in so much 
love that it's more than she could bear."
ほら、こちらへおいでよ、プロデューサー！\n波も太陽も、すごく気持ちいいんだ！,"Hey, Producer, come over here!
The sun and waves feel fantastic!"
" 眩しい日差し、足をくすぐる波\nそこに集う人たちの笑顔……\n本当に、海は素晴らしいね"," 眩しい日差し、足をくすぐる波\nそこに集う人たちの笑顔……\n本当に、海は素晴らしいね"
この場所に孤独はないよ\n私たちが歌い続ける限りね,この場所に孤独はないよ\n私たちが歌い続ける限りね
次は、プライベートで行きたいな\nもちろん、アナタも一緒にね,次は、プライベートで行きたいな\nもちろん、アナタも一緒にね
歯車は噛み合い、絡み合い、\n──そうして『永遠』になるんだよ,歯車は噛み合い、絡み合い、\n──そうして『永遠』になるんだよ
プロデューサーが望むなら、\nどんな私でも見せてあげるよ,プロデューサーが望むなら、\nどんな私でも見せてあげるよ
カメラの前で、私はアイドルだ\nけれど、アナタが向けるカメラの前では……どうなのだろうか,カメラの前で、私はアイドルだ\nけれど、アナタが向けるカメラの前では……どうなのだろうか
この青い空に沈もうか\n──その先に、まだ知らない色が待っているなら,この青い空に沈もうか\n──その先に、まだ知らない色が待っているなら
この時の写真かい？\n……フフ、どうしていると思う？,この時の写真かい？\n……フフ、どうしていると思う？
青く、赤く──\n時に表情を変える空は、まるで人の心のようだね,青く、赤く──\n時に表情を変える空は、まるで人の心のようだね
今日だけは……ゆっくり歩いてもいいかい？,今日だけは……ゆっくり歩いてもいいかい？
あの頃と変わったものがあって\nきっと、変わらないものもある\n花火の輝きが変わらないように,あの頃と変わったものがあって\nきっと、変わらないものもある\n花火の輝きが変わらないように
──私たちの世界へようこそ\n歓迎するよ、お客人,──私たちの世界へようこそ\n歓迎するよ、お客人
からん、ころん\n花火ですぐ掻き消えるこの音も\nなんだか無性に愛おしいよ,からん、ころん\n花火ですぐ掻き消えるこの音も\nなんだか無性に愛おしいよ
その皮の下に眠るは牙剥く獣か\n或いは無垢な少女か,その皮の下に眠るは牙剥く獣か\n或いは無垢な少女か
それじゃあ、行こうか────,それじゃあ、行こうか────
アナタならなんとかなるだろう？\n──マドモアゼル,アナタならなんとかなるだろう？\n──マドモアゼル
絶対という言葉はない\n──私というルールの外にはね,絶対という言葉はない\n──私というルールの外にはね
今度はちゃんと、海まで────,今度はちゃんと、海まで────
さぁ、歌いなさい\n鉄が軋み喜びの声をあげるように──,さぁ、歌いなさい\n鉄が軋み喜びの声をあげるように──
──さて、食事の時間だ,──さて、食事の時間だ
──……フフ。おいで？,──……フフ。おいで？
深く沈んで、奥の奥まで──\n──……そうして、\nずっと囚われてしまえばいい,深く沈んで、奥の奥まで──\n──……そうして、\nずっと囚われてしまえばいい
……ああ、少し照れてしまうな\n上手く吸血鬼になれているかい？,……ああ、少し照れてしまうな\n上手く吸血鬼になれているかい？
私がキミを乗りこなす\nともに、どこまでも歌を追い続けよう,私がキミを乗りこなす\nともに、どこまでも歌を追い続けよう
……内側から焼かれるようだ,……内側から焼かれるようだ
これは、悔しさを忘れないための\n戒めでもあるんだ,これは、悔しさを忘れないための\n戒めでもあるんだ
迷わせてあげようか\n二度と、ここから出られないように,迷わせてあげようか\n二度と、ここから出られないように
……情けない私は嫌いかな？\nそれも知って、愛してもらえたら──\nなんて、自分勝手だろうか,……情けない私は嫌いかな？\nそれも知って、愛してもらえたら──\nなんて、自分勝手だろうか
気を付けて？\n私が示すこの道は、\n幻かもしれないのだから,気を付けて？\n私が示すこの道は、\n幻かもしれないのだから
瞬く間に過ぎても──……,瞬く間に過ぎても──……
最近は食べ物の話ばかり\nしている気がするなぁ\n食欲の秋、だね,最近は食べ物の話ばかり\nしている気がするなぁ\n食欲の秋、だね
勝とうというのかい？\nこの私に？,勝とうというのかい？\nこの私に？
すぐに駆けていってしまう\n季節だからこそ──\n大事な人と、大切に過ごしたいんだ,すぐに駆けていってしまう\n季節だからこそ──\n大事な人と、大切に過ごしたいんだ
かまわないよ、遊んであげよう\nすぐに終わってしまわなければ,かまわないよ、遊んであげよう\nすぐに終わってしまわなければ
──……どう、かな……？,──……どう、かな……？
こういう格好をしても\nいいんだなって……\n少しだけ、自信がついたんだ,こういう格好をしても\nいいんだなって……\n少しだけ、自信がついたんだ
欲しい言葉はわかっているよ\n言ってあげよう\n──さぁ、ほら……『おいで？』,欲しい言葉はわかっているよ\n言ってあげよう\n──さぁ、ほら……『おいで？』
顔、赤くなってない……？\n……慣れていないものだから,顔、赤くなってない……？\n……慣れていないものだから
私がキミを帰したくないのか\nキミがここから帰れないのか,私がキミを帰したくないのか\nキミがここから帰れないのか
──逃がさない,──逃がさない
アナタはときめいてくれるのかな？,アナタはときめいてくれるのかな？
私のコレクションにしてしまおうか,私のコレクションにしてしまおうか
『顔を見せて？』と言うより\n『こっちを見て？』とお願いする方が\n望んだ結果を得られるらしいよ,『顔を見せて？』と言うより\n『こっちを見て？』とお願いする方が\n望んだ結果を得られるらしいよ
──許そう\n私に目を奪われることを,──許そう\n私に目を奪われることを
さあ、私の手を取って\nどこまでも行こう,さあ、私の手を取って\nどこまでも行こう
この間、散歩をしていたら\nとても素敵な景色を見つけてね\n今度、一緒に見に行かない？,この間、散歩をしていたら\nとても素敵な景色を見つけてね\n今度、一緒に見に行かない？
ねぇ、今日は一緒に帰らない？\nアナタとゆっくり話をしながら\n帰りたい気分なんだ,ねぇ、今日は一緒に帰らない？\nアナタとゆっくり話をしながら\n帰りたい気分なんだ
プロデューサーとなら\nどこまでも行ける気がするんだ\nアナタも、そう思わない？,プロデューサーとなら\nどこまでも行ける気がするんだ\nアナタも、そう思わない？
この先、何があったとしても\nきっとアナタは\n私のそばにいてくれるのだろうね,この先、何があったとしても\nきっとアナタは\n私のそばにいてくれるのだろうね
素敵な出会いがあるといいな……,素敵な出会いがあるといいな……
降り注ぐ花びらが\n私を歓迎してくれているようだ,降り注ぐ花びらが\n私を歓迎してくれているようだ
どんなに小さな思い出も\nまばゆく光って、私の中に────,どんなに小さな思い出も\nまばゆく光って、私の中に────
記憶のひとひらが\n頬を優しく撫でていく,記憶のひとひらが\n頬を優しく撫でていく
新しい思い出を\nアナタと共に,新しい思い出を\nアナタと共に
…………\n何かを言うのは良くないね\nアナタに会えただけで十分さ,"......
It's okay to say nothing.
Just meeting you is enough."
ありがとう\nアナタはとても義理堅いね\n私も、次は応えなくては,"Thank you. You are very 
courteous. I must respond 
in kind next time."
──……っと……\nあ、えっと……ありがとう\nこれは……嬉しい、ものだね,"──...Uhm...
Ah, well... Thank you.
This is... very kind."
短冊に何と書いたんだい？\nいや……もし私に叶えられるものならいいな、と思ってね,"What did you write? Ah... 
I just thought it'd be nice 
if I could make it happen."
月を見ると、なんだか\n胸がざわめくような……\n……クス、なんてね,"When I gaze at the moon, it 
makes my heart flutter... 
...Pfft, kidding."
言われる側も楽しそうだね\nアナタがどんな悪戯をするのか\n……フフ、興味があるよ,"Being the one asked ""Trick or
Treat"" seems fun too. What
trick would you play? I'm curious."
それよりプロデューサー\n聞いて聞いて！,"More importantly──
Guess what, Producer!"
プロデューサーは心配性だなぁ\n三峰なら平気だって,"You worry too much, Producer.
Mitsumine will be just fine!"
プロデューサーは、アイドルを\nやる気にさせる天才かもね,"When it comes to motivating
idols, you just might be a
genius."
受けたご恩はきっちり覚えておりますよ？　だからこそ、立派になった姿を見せてるわけですから──なんてね！,受けたご恩はきっちり覚えておりますよ？　だからこそ、立派になった姿を見せてるわけですから──なんてね！
やめて！\n……──て、あ、ごめん……\nあはは、慣れてなくてさ……,"STOP!
...Ah, sorry...
Haha, I'm not used to it..."
……まったく～\n三峰は猫とかじゃ\nないんですけどねー？,"...Oh, come on～
Is Mitsumine supposed to be
a cat or something?"
……ねぇ、なんのつもり？,Hey. What are you trying to do?
やっぱりプロデューサーも\n気になる？\n…………大きさ……,"Producer, you're still curious
about them? About their size..."
