ja,en
……ごめん、寒いのに\n待たせちゃった？,……ごめん、寒いのに\n待たせちゃった？
はー……見て\n息、真っ白,はー……見て\n息、真っ白
走っているの、ずっと,走っているの、ずっと
冷たい空気の方が\n澄んでいるような気がしない？,冷たい空気の方が\n澄んでいるような気がしない？
……ずっと、前にだけ,……ずっと、前にだけ
……ありがとう\n捕まえてくれて,……ありがとう\n捕まえてくれて
……少し\n考え事をしていたの,……少し\n考え事をしていたの
手にするのが罪だとしても,手にするのが罪だとしても
あの雲は\nどこまで続いているんだろう,あの雲は\nどこまで続いているんだろう
いいの、それが欲しかったはずだから,いいの、それが欲しかったはずだから
人魚姫でも……ずっと、歌って踊っていたい,人魚姫でも……ずっと、歌って踊っていたい
綺麗だね……\nこのステージ,綺麗だね……\nこのステージ
踊って、歌うよ\n……どこでだって,踊って、歌うよ\n……どこでだって
魚たちも楽しんでくれているかな？,魚たちも楽しんでくれているかな？
輝いていたいの\n今も、未来も,輝いていたいの\n今も、未来も
大事なのは協力して乗り越えること──,大事なのは協力して乗り越えること──
歩くの、すごく難しいの,歩くの、すごく難しいの
私の今の姿、私だけの曲で届けたい,私の今の姿、私だけの曲で届けたい
うん\n──歩けるよ,うん\n──歩けるよ
届けられたかな……\n私の想い、全部……,届けられたかな……\n私の想い、全部……
とろけてみる？　一緒に,とろけてみる？　一緒に
幸せだって思える場所は、\nひとつじゃないのかもね,幸せだって思える場所は、\nひとつじゃないのかもね
待っていて\nきっと見つけるから,待っていて\nきっと見つけるから
私にしかできないこと\nあるよね？,私にしかできないこと\nあるよね？
笑ってほしいって、\nずっと思ってくれていた？,笑ってほしいって、\nずっと思ってくれていた？
ありがとう\n来れてよかった,ありがとう\n来れてよかった
楽しみ方、合っているのかな,楽しみ方、合っているのかな
このはばたきが\nいつか世界を変える風になるから,このはばたきが\nいつか世界を変える風になるから
世の中には、まだまだ私の知らない\n楽しいことがあるんだろうね,世の中には、まだまだ私の知らない\n楽しいことがあるんだろうね
私の風を届けたいの\nいつまでも,私の風を届けたいの\nいつまでも
私は……\n馴れ合うヤツらなんかとは違う,"I'm not one of those people...
who get friendly with others."
ほしくない……\n何も…………誰も…………,"I don't want anything... 
Anything... Anyone..."
アハハッ、そうこなくっちゃさァ！,"Ahaha, that's the way it should be!"
とりあえず終わったか\nま……上出来だろ,"At least it's over now.
Well... Good job."
は……？,Huh...?
んだよ、触んじゃねェよ！,"What the, don't touch me!"
何考えてんだよ……！,What are you thinking...!
いい加減にしろよ……！,Knock it off...!
おい……,Oi...
何してんだよ！,What are you doing!
"アイツ、誕生日か……
何か……用意しとくか……","It's her birthday, huh... 
Maybe... I should prepare 
something..."
来んな……呼んでねぇ……,Don't come... I didn't call...
割れてたら……悪いのかよ……,割れてたら……悪いのかよ……
噛まれたくねェなら\n近づくな────,噛まれたくねェなら\n近づくな────
雑音……雑音……\n邪魔ばっか……,"Noisy... So noisy...
It's so distracting..."
手なずけられるとでも\n思ってんのか────,手なずけられるとでも\n思ってんのか────
全っ然めでたくねェ────,Not happy at ALL──
正月もオメェと一緒とか……,"Guess I'm spending
New Years with you..."
用意はいいかよ\nここからのステージ、\n乗れねェやつは置いていく────,用意はいいかよ\nここからのステージ、\n乗れねェやつは置いていく────
なんだよ……\n衣装の感想とかいらねェから,なんだよ……\n衣装の感想とかいらねェから
響かせる\nこの世の果てまで──────,響かせる\nこの世の果てまで──────
見たくねェ、こんな空────────,I don't want to see this sky──
そんなにやりたきゃ勝手にやれよ,そんなにやりたきゃ勝手にやれよ
曖昧な存在────？\nテメェは違うのかよ──────,曖昧な存在────？\nテメェは違うのかよ──────
めちゃくちゃにしてやる\nそうしてほしいんだろ────？,めちゃくちゃにしてやる\nそうしてほしいんだろ────？
その幻想を……\n撃ち抜け────────,その幻想を……\n撃ち抜け────────
あっつ────────,Too hot──
こんなんじゃ\nイラつき\n収まんねェ────,こんなんじゃ\nイラつき\n収まんねェ────
この熱に乗って\n落ちずに飛び続ける────,この熱に乗って\n落ちずに飛び続ける────
オメェと一緒に\nプールとか……\n意味わかんねェ────,オメェと一緒に\nプールとか……\n意味わかんねェ────
どこまでも続く渇望────\n先に何があろうと────,どこまでも続く渇望────\n先に何があろうと────
──どう？ 可愛い？\nあはっ、プロデューサーに言われると\n元気出るなー,"──What do you think? Cute?
Aha, I feel better when you
tell me that, Producer."
『翼』の漢字の中には、\n『羽』の文字が入ってるよね\n ……だから、運命かもって思ったの,"Tsubasa has the character for 
Feather, right?
...So it MUST be fate."
鈴木羽那、アイドル頑張りまーす,"I'm Hana Suzuki, 
as an idol I'll do my beeest."
わーっ、すごい──！\nプロデューサー、こんなにずーっと\nあたしのこと、支えてくれてたんだね,"Wow, amaaazing! You've been 
supporting me for such a long 
time, Producer."
"……？
髪の毛になんか
ついちゃってた？","......?
Is there something in my hair?"
あはっ\nもしかしてなでなでの刑？,"Aha. Is this maybe 
a headpat penalty?"
うそー……,No waaay...
ちょっと──！\n声かけてくれればいいのにーっ,"Heeey!
Why didn't you just call out to meee."
……くすぐろうとしてる？,... Are you trying to tickle me?
ふふっ\nかまってほしいなら\nそう言ってほしいなーっ,"Fufu.
If you want my attention, just say sooo."
プロデューサーのこと、意識してたよ,"I was thinking about you, Producer."
……変な顔の写真は\nちゃんと消しておいてね？,"... Make sure to delete any photos 
with me making funny faces, okay?"
米ティック……\nあはっ、なんでもないよ,"CoMEDIK... 
Aha, it's nothing."
ここはスタジオ、\nそのスマホは大きなカメラ、\nプロデューサーは……ふふっ──！,"This here is a photo studio, 
that smartphone is a big camera 
and Producer is... Fufuuu!"
コメティックの鈴木羽那でーすっ,CoMETIK's Hana Suzuki heeere.
永遠を誓ってくれますか？,Will you pledge for eternity?
彼女みたい？,Looking at that girl?
いろんな色、\n綺麗だね,"So many colors... 
So beautiful."
ウエディングドレスって──\nあはっ、彼女超えてるよね？,"This wedding dress──
Aha, it's better than hers, right?"
ねぇ、何色にしてくれるの？,"Hey, what color will you dye me?"
……プロデューサーの嘘つき,"... Producer, you liar."
プロデューサーにも\n食べてほしいんだけどなーっ,プロデューサーにも\n食べてほしいんだけどなーっ
白と黒、\nどっちにする？,白と黒、\nどっちにする？
テーマパーク\nまた一緒に行ってくれる？,テーマパーク\nまた一緒に行ってくれる？
このまま\n飛んでいけたらいいよね──！,このまま\n飛んでいけたらいいよね──！
"わたし、広い世界が見たいんです
アイドルなら、それができるかもって","I want to see the wider world. 
If I become an idol, I might be 
able to do that."
"今すぐこの気持ちを……
歌やダンスで表現できたら
どんなに素晴らしいんだろう……！","If I could express these feelings
through song and dance...
Wouldn't that be wonderful...?"
"郁田はるき、高校２年生です
アイドル、始めます……！","I'm Haruki Ikuta, a sophomore.
I'm starting as an idol...!"
プロデューサーさんがいれば\nわたしどんなことでも\nできそうな気がするんです,"I feel like I can do anything
with you around me,
Producer-san."
"わっ……
急に触られると
驚いちゃいます……！","Wa...
You surprised me when you
suddenly touched me...!"
うーん……\nふふ……\nうとうとしちゃいますねぇ……,"Hmm... Fufu...
I'm starting to feel sleepy..."
"うっ
痛いです……","Ow... 
That hurts..."
なんなんですか？\nもう……,"What are you doing?
Jeez..."
"邪魔ですか？
よけますね～","Am I in your way?
I'll move out of it～"
ふふっ、\nとなり来ますか～？,"Fufu, would you like to
be next to me～?"
"今日は羽那ちゃんが主役ですよ～！
プロデューサーさんも盛り上げ要員
よろしくお願いします……！","Hana-chan's the star today～!
Producer-san is vital to the
excitement too, if you please!"
心に……しまいきれない────,I can't keep this... in my heart──
"プロデューサーさんといると
わたしは、本当にいろんなものを
見つけられるんです","Producer-san, when I'm with 
you, I can discover so many 
things."
"終わりなき旅路に
退屈しないで
わたしと遊ぼう？","Try not to get bored in this
endless journey. Would you
like to play with me?"
わたし、こんなふうに\n名前呼んでもらうこと\nあまりなかったので、どきどきします,"I haven't had my name 
called like this before. 
It's kind of exciting."
追いかけてるのかな？\n追いかけられてるのかな？\nこの光────,"Am I chasing this light, 
or am I being chased?"
もう少し……待ってて……！,Please... wait a bit longer...!
桜の花びらって近くても遠いような\n手で触れても、\nつかまえられないような……,"The cherry blossom petals seem so close yet so far away.
Even when I touch them with my hand, I can't seem to catch them..."
わたしから\nあふれだした　いろ\nそれから　ことば,The colors and words are overflowing from me.
今、ここにいることを思うと\n時々、胸がきゅうってなります\nどうしてなんでしょう……,"When I think about being 
here right now, my chest feels 
heavy sometimes. I wonder why..."
歌うこと\n描くこと\nどれほどの違いがあるのかな,I wonder what the difference between singing and drawing is.
あなたは、ずっと────,"You are, always──"
"届くでしょうか
……いえ、たとえ
届かなくったって──","Will it reach you?
... No, even if...
It doesn't reach you──"
"反射する光の中
ただ翻弄されるなんていや","I don't want to toss about 
in the reflected light."
見つけたんです\nだから、信じたくなったんです永遠,"I found it, so I want to believe in it... forever."
遠く手を伸ばした彼方\n永遠を手にした彼方,"I want to reach out to the distance, beyond what holds eternity in its hands."
ルビーです！\n今日はよろしくお願いします,ルビーです！\n今日はよろしくお願いします
ママみたいなアイドルになるために──,ママみたいなアイドルになるために──
本物のアイドルってさ\n誰かの人生を変える力があるんだよ,本物のアイドルってさ\n誰かの人生を変える力があるんだよ
ん？　なに？　ゴミついてた？,ん？　なに？　ゴミついてた？
これが芸能界の闇……！,これが芸能界の闇……！
ん？　腹から声出せってこと？,ん？　腹から声出せってこと？
ルビーです！\n今日はよろしくお願いします,ルビーです！\n今日はよろしくお願いします
突然来てご迷惑じゃ\nなかったですか！？,突然来てご迷惑じゃ\nなかったですか！？
じゃあ、お願いします！\nカメラマンさん！,じゃあ、お願いします！\nカメラマンさん！
収録用のセット見た！？\nすごいの、テレビ番組みたい！,収録用のセット見た！？\nすごいの、テレビ番組みたい！
後悔しないように\nやれる限りのことは\nやっておかないとね！,後悔しないように\nやれる限りのことは\nやっておかないとね！
プロデューサーが\n元気になれますように！,プロデューサーが\n元気になれますように！
私もたまにミスしちゃうけど大丈夫！\n落ち込むより、どうリカバリーするかじゃない？,私もたまにミスしちゃうけど大丈夫！\n落ち込むより、どうリカバリーするかじゃない？
笑顔にしてみせるよ！\nほらっ、一緒に楽しもう？,笑顔にしてみせるよ！\nほらっ、一緒に楽しもう？
大事にするに決まってるよ！\nプロデューサーは、\n私のファンなんだから！,大事にするに決まってるよ！\nプロデューサーは、\n私のファンなんだから！
誰かの光になれてるかな……\n私にとっての、ママみたいに,誰かの光になれてるかな……\n私にとっての、ママみたいに
私はどんなアイドルになればいいと思う？,私はどんなアイドルになればいいと思う？
努力だけじゃ駄目\n誰かに必要とされなくちゃ,努力だけじゃ駄目\n誰かに必要とされなくちゃ
（やる！　やってやるわよ────！）,（やる！　やってやるわよ────！）
何？　頭に何かついてた？,何？　頭に何かついてた？
髪の手入れには気を遣ってるわ\n自分が商品なんだもの,髪の手入れには気を遣ってるわ\n自分が商品なんだもの
きゃあっ！　訴えるわよ！,きゃあっ！　訴えるわよ！
どうしたの？,どうしたの？
ちょっと、やめなさい！,ちょっと、やめなさい！
体力つけとく必要があるし、\n筋トレも走り込みも欠かさないわよ,体力つけとく必要があるし、\n筋トレも走り込みも欠かさないわよ
……あの、すみません,……あの、すみません
……気にしないで？\n昔、そういう歌があったって\nだけだから,……気にしないで？\n昔、そういう歌があったって\nだけだから
余裕でパフォーマンスを\n決めて見せるから\nちゃんとそこで見てなさいよ！,余裕でパフォーマンスを\n決めて見せるから\nちゃんとそこで見てなさいよ！
まかせてください！\n最高に面白いCMにしましょう！,まかせてください！\n最高に面白いCMにしましょう！
そっか、私……\nちゃんと結果を出せたんだ\n期待に応えることができたのね……,そっか、私……\nちゃんと結果を出せたんだ\n期待に応えることができたのね……
……私をどうしたいのよ,……私をどうしたいのよ
褒めても何もでないわよ,褒めても何もでないわよ
……私は、新人アイドル有馬かな\n──ここから、羽ばたいてみせる,……私は、新人アイドル有馬かな\n──ここから、羽ばたいてみせる
差し入れ、よかったわよ\n稽古場でも好評だったし\nありがとう,差し入れ、よかったわよ\n稽古場でも好評だったし\nありがとう
誰かが信じてくれる限り\n期待に応えたいのよ、絶対に,誰かが信じてくれる限り\n期待に応えたいのよ、絶対に
この事務所って、\nフリーWi-Fiあるんだっけ……？,Does this place have free Wi-Fi?
みんな忙しそうだなぁ……,It sure is busy here.
あ、おやつがある……！\n私も貰っていいのかなぁ……,"Nice, there's snacks!
Wonder if I can have some......"
角が気になる？,Curious about the horns?
ん……？,Hm......?
大丈夫？　事務所炎上するよ？,"Are you cool with getting
the whole agency cancelled?"
証拠は動画でおさえたけど……どうする～？,"I've got video evidence.
Whatever shall I do with it～?"
ちょっと離れてほしいかなぁ,"Let's take it down
a notch, 'kay?"
距離近すぎだなぁ……,"You're a little
close there......"
一番に見せるなんて、特別だよぉ？,一番に見せるなんて、特別だよぉ？
あのあと動画作った？\nプロデューサーの成長、\n見せてもらいたいなぁ,あのあと動画作った？\nプロデューサーの成長、\n見せてもらいたいなぁ
みんな～～！？\n黄色のライト振り回す準備は\nできてる～！？,みんな～～！？\n黄色のライト振り回す準備は\nできてる～！？
同世代トークができるのって\nなかなか貴重なんだよねぇ……,同世代トークができるのって\nなかなか貴重なんだよねぇ……
今この瞬間！\n世界で一番楽しませてみせるから！,今この瞬間！\n世界で一番楽しませてみせるから！
お疲れ様です～,Good work today～
適宜休んでくださいね～,"Please get some proper rest, okay～"
冷蔵庫におやつがありますよ～\nもちろん、プロデューサーさんの分も\n買ってます♪,"There are snacks in the fridge～
Of course, I bought some for
you too♪"
プロデューサーさん……？\n大丈夫ですか？,"Producer-san...?
Is everything alright?"
今お時間大丈夫でしょうか～？\n業務のご相談をさせてください,"Do you have some time right
now～? I'd like to discuss some
things with you."
事務作業間に合いそうですか？\n手伝えますから、\nおっしゃってくださいね～,"Do you think you can finish
the paperwork on time? I can
help, so please let me know～"
ずっと同じ姿勢だと、\n身体を悪くしてしまいますよ～,"If you stay in the same posture, 
you'll make your body worse."
～～～♪,Mhmhmhm♪
……！\nも～社長、年度間違えてる……,"......!
Jeez, President, you got the
year wrong..."
明日の来客予定は……──,"Tomorrow's scheduled guests
are...──"
……髪に何かついていたでしょうか～,"......Was there something in
my hair～?"
寝ぐせでもありましたか？,Do I have bed head?
プロデューサーさんのこと、\n尊敬していたんですが……,"I had a lot of respect for you,
but now..."
何かご用ですか？\n声をかけていただければ\nわかりますよ～,"Is there something I can help with?
Just shout and I'll come help you～"
ええと……どうかされましたか？,U-Uhm... Is something the matter?
むんっ、\n今日も頑張りましょうっ,"Mun!
Let's also do our best
today."
こんにちは、プロデューサーさんっ,"Hello, Producer-san."
ほわぁ、\n今日はどんなことするんでしょうか？,"Howaa, I wonder what
we're doing today?"
お疲れ様です！\nプロデューサーさんっ\n今日も頑張りますねっ,お疲れ様です！\nプロデューサーさんっ\n今日も頑張りますねっ
プロデューサーさん！\n最近お仕事が楽しいんですっ,プロデューサーさん！\n最近お仕事が楽しいんですっ
今日も元気です！　むんっ\nプロデューサーさんはお元気ですか？,"I'm doing well today! Are you doing well yourself, Producer?"
プロデューサーさん、\nどうしたんですか……？,プロデューサーさん、\nどうしたんですか……？
ほわぁ、何をすれば\nいいんですか……？,ほわぁ、何をすれば\nいいんですか……？
……ぽかぽかお天気で\n眠くなってきました,The warm weather makes me feel sleepy.
プロデューサーさーんっ\n私、待ってますよっ,"Producer, I've been waiting for you."
えっと、早くしないと\nレッスンの時間になっちゃいますっ,えっと、早くしないと\nレッスンの時間になっちゃいますっ
今度のお休みに、一緒に\n日向ぼっこしませんか？,"On our next day off, would you like to laze around under the sun with me?"
何かが掴めそうな\n気がしますっ,"I feel like I can reach
new heights."
急にこんなこと……\nどうしてですか……？,"To do something like this
out of the blue... Why?"
ひゃっ！\n……うう、困ります,"Hyaa!
Uuh... Please don't do
that."
え……？\nプロデューサーさんが\nこんなことするなんて……,"Eh? Producer-san, I
didn't know that you'd do
something like this."
ほわぁ……、\nマッサージですか？\n気持ちいいです……,ほわぁ……、\nマッサージですか？\n気持ちいいです……
ふふっ、\nくすぐったいですよっ,ふふっ、\nくすぐったいですよっ
ひゃっ！？　……あっ\nプロデューサーさんでしたか\n少しびっくりしちゃいました,ひゃっ！？　……あっ\nプロデューサーさんでしたか\n少しびっくりしちゃいました
えっと……ダメです\nプロデューサーさん,"Umm... You shouldn't do
that, Producer-san."
プロデューサーさんて、\nそういうことする人\nだったんですか……？,プロデューサーさんて、\nそういうことする人\nだったんですか……？
こんなの…………\n……ショックです,This... is quite a shock for me.
プロデューサーさん……？\nあ、あの……えっと,"Producer-san?
U-Umm... Well..."
もう……\n恥ずかしいですよ、\nプロデューサーさん……,"Come on now...
You're embarrassing me,
Producer-san..."
ひゃぁっ！\nく、くすぐったいです……\nプロデューサーさん,"Hyaa!
T-That tickles,
Producer-san."
お疲れ様です\n今日もよろしくお願いします,"Good work so far.
I'll be counting on you
again today."
プロデューサー、今日の予定はどうなっていますか？,"Producer, what's the
schedule for today?"
こんにちは、プロデューサー,"Hello, Producer."
プロデューサー\n今日も１日、よろしくお願いしますね,"Producer, I'll be
counting on you
again today."
プロデューサー、いつもお疲れ様です,"Producer, thank you for
always working so hard."
こんにちは、プロデューサー\n最近レッスンの調子がいいみたいです,"Hello, Producer.
It seems that the lessons
are going well in these
past few days."
プロデューサー？\n私の話、聞いてますか？,"Producer?
Are you listening to me?"
努力しても努力しても、\nし足りないんです,"No matter how hard I try,
it's just not enough."
あとどのくらい頑張ったら、\n理想の自分に\nなれるんでしょうか……,"I wonder how much more
effort I need to put in
to attain my ideal self."
実は今日、筋肉痛で……\n……他の子には、\n言わないでください,"To be honest, I have
muscle pain today...
...Please don't tell the
other girls."
今日の占いによると……\nプロデューサーの運勢は\n結構いいみたいです,"According to today's
fortune... It seems your
luck is pretty good."
事務所、自分の家よりも\n居心地がいいんですよね,"This office feels more
like home compared to
our own homes, doesn't
it?"
うーん、あとちょっとで何かが掴めそうなんですが,"Hmm, it seems like I'll
be able to grasp
something soon."
……何か用なんですか？,...Do you need something?
……触らないでください,...Don't touch me.
……私に触る必要性、ありますか？,"...Was it necessary to
touch me?"
……なんだか、\n緊張がとけました,"...My nervousness
vanished a bit."
ふふ……\n結構鍛えてるんですよ、ほら,"Fufu...
Hey, I shall teach you
some self-restraint."
もう……\n触らないでくださいって……,"Geez...
I told you to please not
touch me......"
やめてください！,Stop that!
今のって……\nわざと、ですよね？,"What you did just now...
That was intentional,
wasn't it?"
ちょっ……\nいい加減にしてください,"Hey...
Please stop doing that!"
あまり、自信がないんです……\nどう、ですか……？,"I'm not confident about
them... What do you think
of them?"
あの……\n恥ずかしいです……,Umm... This is embarassing...
プロデューサー……これ以上は……\nお、怒りますよ？,"Producer... If you keep
it up... I-I'll get mad,
you know?"
