id,name,text,trans
0000000000000,SNSの投稿,『果穂ちゃん超いい笑顔だった～～～～』,"""Kaho-chan had a really nice smile～～～～"""
0000000000000,SNSの投稿,『何気に初出情報じゃない？』,"""Isn’t this the first time we heard about this?"""
0000000000000,SNSの投稿,『ジャ、って言いかけてたの可愛いかよ』,"""so cute when she almost said Jus-"""
0000000000000,SNSの投稿,"『ジャスティスⅤの先輩キャラといえば、
ジャスティスパープルこと紫野です！！！！』","""Justice V's senpai character is Yukari, also known as Justice Purple!!!!"""
4001062020010,ジャスティスレッド,"くそ……っ！
攻撃が届かない……！","Darn it...!
The attack isn't working...!"
4001062020020,ジャスティスレッド,どうすれば……！,What should I do...!
4001062020030,ジャスティスパープル,……天下のレッドがこの体たらくか？,...How do you call yourself Red like this?
4001062020040,ジャスティスレッド,"パープル！
来てくれたのか！","Purple!
You came!"
4001062020050,ジャスティスパープル,当たり前だろ,Of course.
4001062020060,ジャスティスパープル,"……お前たちのことはどうでもいいけどな
この街を守るのは俺の仕事だ","...I don't care about you all,
but it's my job to protect this city."
4001062020070,ジャスティスパープル,──足手まといにはなるなよ,──Don't get in my way.
4001062020080,ジャスティスレッド,ああ！,Sure!
0000000000000,SNSの投稿,『チョコちゃんにあの印象はないがw』,“thats nothing like choco-chan lol”
0000000000000,SNSの投稿,『果穂ちゃんどこが似てるって思ったのか詳細教えて～！』,"""Kaho-chan, please tell me in detail where their similarities are～!"""
4001062020090,樹里,果穂とチョコはこの辺来たことあるんだよな？,"Kaho and Choco have been here before, right?"
4001062020100,智代子,"そうそう！
強化合宿の時にね","Oh yeah!
During the training camp."
4001062020110,智代子,"でもほとんど合宿所にいたから
観光地まわった記憶はないんだ……！","But since we mostly stayed at the training camp,
I don't remember visiting any tourist spot...! "
4001062020120,果穂,"お土産屋さんは覚えてます！
おっきなところ……！","I remember the souvenir shop!
It's really big...!"
4001062020130,智代子,"あっ、近くの道の駅だっけ！？
ソフトクリーム美味しかったとこだよね！","Oh, the one at the roadside station nearby!?
Their soft serve ice cream was delicious! "
4001062020140,果穂,はい！,Yes!
4001062020150,夏葉,"あら、素敵じゃない
帰りに寄れたりするかしら","My, that sounds nice.
Maybe we can stop by on the way back."
4001062020160,樹里,"っていうか、今回の行き先に道の駅なかったか？
そこなんじゃ──","Actually, isn't there a roadside station where we're heading to?
Maybe it's there──"
4001062020170,智代子,"それが……
写真だけだと同じとこかわかんなくて……！","Well...
I can't tell if it's the same place judging by the photos...!"
4001062020180,樹里,"あー
何か所かあったりするもんな","Ah.
I guess there are several places like that."
4001062020190,夏葉,"その時の道の駅だったら
嬉しい偶然よね","If it's indeed the same roadside station,
what a happy coincidence that will be."
4001062020200,凛世,はい……,Yes...
4001062020210,樹里,アタシも行けたらよかったのになあ、合宿,Wish I had gone to the training camp too.
4001062020220,夏葉,うふふ、それは確かに,"Hehe, I feel the same."
4001062020221,果穂＆智代子,……,......
4001062020230,夏葉,"……──ねぇ、そういえば
果穂と智代子の呼び方が変わったのもその頃じゃない？","...──Hey, now that I think about it. Wasn't it around
that time that Kaho and Chiyoko changed how they
call each other?"
4001062020240,樹里,"あ、そうそう
合宿終わったあとに教えてもらったんだった","Oh, true.
They said so after the training camp was over."
4001062020250,樹里,『ジャスティスⅤ』のキャラと一緒にしたんだって,"I was told that it's a ""Justice V"" reference."
4001062020260,樹里,"当時はそうなんだと思って終わりにしちゃってたけど
似てるキャラがいるってのは初耳だったな","At that time, I didn't ask anything further.
I didn't know there's a character that acts like
Choco until now."
4001062020270,夏葉,"そう、私もそこが気になっていたの！
そのキャラがどんな人なのか","Yes, that's what I was wondering about too!
What kind of person is that character?"
4001062020280,夏葉,"樹里も知らなかったのね
凛世は？","Even Juri didn't know.
How about Rinze?"
4001062020290,凛世,はい……,Yes...
4001062020300,凛世,"凛世も……
存じ上げず……","Rinse too...
was unaware..."
4001062020310,智代子,いやでも、似てるなんて恐縮といいますか……！,"I feel bad being compared to the character, though...!"
4001062020320,果穂,"そんなことないです！
ちょこ先輩はゆか先輩とおんなじでした！","No way!
Choco-senpai is the same as Yuka-senpai!"
4001062020330,果穂,──あっ、ゆか先輩はジャスティスパープルでっ,"──Ah, Yuka-senpai is Justice Purple."
4001062020340,果穂,"本当は紫野って名前なんですけど、
レッドからは『ゆか先輩』って呼ばれてます！","The real name is Yukari,
but Red says ""Yuka-senpai""!"
4001062020350,樹里,へぇ、じゃあチョコはそのゆか先輩に似てるのか,"Huh, so Choco is like that Yuka-senpai."
4001062020360,果穂,はい！,Yes!
4001062020370,果穂,"あっ！
でもゆか先輩はゆか先輩って呼ぶとおこります！","Ah!
But Yuka-senpai gets mad when hearing ""Yuka-senpai""!"
4001062020380,果穂,"名前が可愛すぎるって──
そこはちょこ先輩とちがうんです！","Because the name is too cute──
That's different from Choco-senpai! "
4001062020390,凛世,"可愛い呼び方は……
お嫌いなのでしょうか……","So Yuka-senpai...
doesn't like the cute nickname..."
4001062020400,果穂,"ゆか先輩は『男気の男』なんです！
だからイメージと違う！　って！","Because Yuka-senpai is a ""manly man""!
The name is different from his image!"
4001062020401,樹里＆凛世＆夏葉,えっ,Eh.
4001062020410,ジャスティスレッド,──ありがとな、ゆか先輩！,"──Thank you, Yuka-senpai!"
4001062020420,ジャスティスパープル,"変身中はもとの名前で呼ぶなっていつも言ってるだろ……
敵倒したからって緩みすぎなんだよ","I've always told you not to say my real name when I've
transformed. Even if we can defeat the enemy,
you're too careless."
4001062020430,ジャスティスレッド,"あっ！　へへ……！
悪かった、つい……！","Ah! Hehe...!
My bad...!"
4001062020440,ジャスティスパープル,"それから、これも死ぬほど言ってるけどな
──『ゆか先輩』は、よせ","Moreover, I've said this too many times.
──Cut that ""Yuka-senpai"" of yours."
4001062020450,ジャスティスレッド,可愛いのに,It's cute though.
4001062020460,ジャスティスパープル,可愛くなくていい,I don't need to be cute.
4001062020470,夏葉,完全に女性で想像していたわ……,I thought it was a girl this whole time...
4001062020480,凛世,はい……,Yes...
4001062020490,凛世,"どう似ているのか……
とても……興味深い……","Their similarities...
are of great interest..."
4001062020500,智代子,"あんまりハードル上げないで～……！
果穂の純粋な目を通したらそう見えちゃっただけだから！","Don't raise the bar too high～...!
That's just how it looks through Kaho's pure eyes! "
4001062020510,果穂,"ゆか先輩は人助けをよくするんですけど、
変身前だと絶対名前を言わなくて──","Yuka-senpai helps people a lot,
but before he transforms, he never says his name──"
4001062020520,果穂,お礼がしたいから名前を教えてって言われると、,"When people asked for his name because they wanted
to thank him, he would say..."
0000000000000,果穂,『名乗るほどのもんじゃねーから』って！,"""The name ain't worth mentioning""!"
4001062020530,果穂,"……？
あれ、智代子さんだ──","...?
That's Chiyoko-san──"
4001062020540,果穂,"智代子さん！
どうしたんですか？","Chiyoko-san!
What's going on?"
4001062020550,智代子,"あっ
えへへ、ちょっと探し物を……！","Oh.
Hehe, I'm just looking for something...!"
4001062020560,果穂,"！
どんなのですか？　お手伝いします！","!
What are you looking for? I'll help!"
4001062020570,智代子,"わぁぁごめんね、ありがとう！
えっと、長財布なんだけど──","Whoa, thanks a lot!
Let's see, it's a long wallet──"
4001062020580,智代子,"チャックで開くタイプで、
表側はブランドのロゴ、裏側は大きいポケットがついてて","It opens with a zipper. There's a brand logo on the
front and a large pocket on the back."
4001062020590,智代子,──ちょうどあそこにあるやつみたいな、水色の──,"──It's light blue, just like the one over there──"
4001062020600,果穂,ちょうどあそこにあるやつ……,Just like the one over there...
4001062020610,智代子,ちょうどあそこにあるやつ！！,Just like the one over there!!
4001062020620,智代子,──果穂ちゃん、ちょっとごめんね、待ってて,"──Kaho-chan, I'm sorry, please wait here."
4001062020630,智代子,"すみませーん！
これって違いますかー！？","Excuse meee!
Is this yours!?"
0000000000000,落とし主,えーっ！？,Huh!?
4001062020640,智代子,今持っていきます！,I'll bring it to you!
4001062020650,智代子,──これです！,──Here you go!
0000000000000,落とし主,"──……ああ、私のよ！
ありがとう……！","──...Yes, it's mine!
Thank you...!"
4001062020660,智代子,！　よかった……！,! I'm glad...!
0000000000000,落とし主,"なんてお礼を言ったらいいか……
本当に助かったわ","How should I thank you...
You really saved me."
0000000000000,落とし主,"ごめんなさい、ジャージも汚させてしまって……！
一生懸命探してくれたから……！","I'm so sorry for getting your jersey dirty...!
You had to search so hard for it...!"
4001062020670,智代子,"いいんです！
もともと汚れる時のための服ですし！","It's fine!
The outfit was made to get dirty!"
0000000000000,落とし主,"いいえ、せめてお礼とクリーニング代ぐらいは
払わせてちょうだい。お名前は？","Please at least let me thank you and pay for the
cleaning. What's your name?"
4001062020680,智代子,"本当に大丈夫です！
ちょっと手伝ったぐらいですから、ほんとに！","It's really okay!
I just helped out a little bit, really!"
4001062020690,智代子,名乗るほどの者じゃないので……！,My name is not worth mentioning...!
4001062020700,果穂,ちょこ先輩もおんなじだったんです！,Choco-senpai said the same exact thing!
4001062020701,樹里＆凛世＆夏葉,……！,......!
4001062020710,智代子,"我ながら、漫画の台詞みたいなこと言っちゃったなって
思ってるの～……！","Alas, I said something that sounded like a line from a manga～...!"
4001062020720,樹里,"チョコってやっぱりこう、変っつーか
妙にカタい言い回しする時あるよなあ","Choco is kind of... eccentric, after all.
Sometimes she speaks weird and archaic."
4001062020730,智代子,言わないで樹里ちゃん……！,"Don't say that, Juri-chan...!"
4001062020740,樹里,でもすげーかっこいい由来だと思う,"It's a really cool origin story, though."
4001062020750,夏葉,"ええ！
果穂が憧れるヒーローと、同じことをしているんだもの","Right!
She's doing the same thing as the hero Kaho admires."
4001062020760,凛世,"果穂さんは……
智代子さんの中に……","Kaho-san...
saw that..."
4001062020770,凛世,"ヒーローを……
見たのですね……","There's a hero...
in Chiyoko-san..."
4001062020780,果穂,はい！,Yes!
4001062020790,智代子,"……ふふ
恥ずかしいけど、それは確かに光栄だな","...Hehe.
It's embarrassing, but it's certainly an honor."
4001062020800,果穂,！,!
4001062020810,果穂,（今、『名乗るほどの者じゃ』って……！）,"(The ""My name is not worth mentioning"" just now...!)"
4001062020820,果穂,"（『名乗るほどの者じゃないので……！』
『名乗るほどのもんじゃねーから』……！）","(""My name is not worth mentioning...!""
""The name ain't worth mentioning""...!)"
4001062020830,果穂,（智代子さん、ゆか先輩と一緒だ……！）,(Chiyoko-san said the same thing as Yuka-senpai...!)
4001062020840,果穂,──えへへっ,──Hehehe.
4001062020850,果穂,（智代子先輩……！）,(Chiyoko-senpai...!)
4001062020860,果穂,（──ううん、ちょこ先輩かもっ）,"(──No, maybe Choco-senpai)"
4001062020870,果穂,（────うん、ちょこ先輩だ！）,"(────Yeah, Choco-senpai!)"
4001062020880,智代子,──ごめんね果穂ちゃん！　お待たせ！,"──Sorry, Kaho-chan! Thanks for waiting!"
4001062020890,智代子,"どこか行くところだった？
それとも帰り？","Were you going somewhere?
Or heading home? "
4001062020900,果穂,えっと、近くのコンビニに──,"Umm, I'm going to the convenience store nearby──"
4001062020910,智代子,"じゃあ一緒に行ってもいい？
私も買いたいものあるんだぁ","Then can I go with you?
I have something I need to buy too."
4001062020920,果穂,もちろんです、智代子さんっ,"Of course, Chiyoko-san."
info,game_event_communications/400106202.json,
Translator,Ruru,
