id,name,text,trans
4901006040060,社長,"ほう、これはまた抽象的だ
どういうことか教えてくれ","Oh, that's kind of abstract,
So tell me what it means."
0000000000000,プロデューサー,"はい、私にはこれといって強みはありませんが……
だからこそ、アイドルとしっかり向き合いたいなと","Well, I don't have much strength...
That's why I want to face the idol a bit more comfortably."
4901006040070,社長,"……アイドルと真摯に向かい合えること
それも確かに強みだな","...I can face the idol sincerely, 
That's definitely an advantage for me."
4901006040080,社長,"口で言うほど簡単ではない
これからも、その強みは磨いていくといい","Not as easy as it sounds,
I hope you'll continue to improve on your other strengths."
0000000000000,プロデューサー,……はい！　頑張ります！,Of course! I'll do my best!
info,special_communications/490100643.json,
译者,,
